tophub/cuda_v0.07.log
{"i": ["cuda -model=titanx", "topi_nn_conv2d", [["TENSOR", [1, 2048, 8, 8], "float32"], ["TENSOR", [192, 2048, 1, 1], "float32"], [1, 1], [0, 0], [1, 1], "NCHW", "float32"], {}, ["conv2d", [1, 2048, 8, 8, "float32"], [192, 2048, 1, 1, "float32"], [1, 1], [0, 0], [1, 1], "NCHW", "float32"], {"i": 8797896, "t": "direct", "c": null, "e": [["tile_f", "sp", [6, 1, 32, 1]], ["tile_y", "sp", [4, 1, 2, 1]], ["tile_x", "sp", [1, 1, 8, 1]], ["tile_rc", "sp", [64, 32]], ["tile_rx", "sp", [1, 1]], ["tile_ry", "sp", [1, 1]], ["auto_unroll_max_step", "ot", 1500], ["unroll_explicit", "ot", 1]]}], "r": [[5.69732536806342e-05], 0, 14.116215467453003, 1535423916.7184713], "v": 0.1}
{"i": ["cuda -model=titanx", "topi_nn_conv2d", [["TENSOR", [1, 2048, 8, 8], "float32"], ["TENSOR", [448, 2048, 1, 1], "float32"], [1, 1], [0, 0], [1, 1], "NCHW", "float32"], {}, ["conv2d", [1, 2048, 8, 8, "float32"], [448, 2048, 1, 1, "float32"], [1, 1], [0, 0], [1, 1], "NCHW", "float32"], {"i": 734204, "t": "direct", "c": null, "e": [["tile_f", "sp", [28, 2, 8, 1]], ["tile_y", "sp", [2, 2, 2, 1]], ["tile_x", "sp", [1, 1, 8, 1]], ["tile_rc", "sp", [64, 32]], ["tile_rx", "sp", [1, 1]], ["tile_ry", "sp", [1, 1]], ["auto_unroll_max_step", "ot", 0], ["unroll_explicit", "ot", 0]]}], "r": [[9.882545781556573e-05], 0, 20.854647159576416, 1535425623.6315196], "v": 0.1}
{"i": ["cuda -model=titanx", "topi_nn_conv2d", [["TENSOR", [1, 2048, 8, 8], "float32"], ["TENSOR", [384, 2048, 1, 1], "float32"], [1, 1], [0, 0], [1, 1], "NCHW", "float32"], {}, ["conv2d", [1, 2048, 8, 8, "float32"], [384, 2048, 1, 1, "float32"], [1, 1], [0, 0], [1, 1], "NCHW", "float32"], {"i": 1240970, "t": "direct", "c": null, "e": [["tile_f", "sp", [12, 1, 16, 2]], ["tile_y", "sp", [2, 2, 2, 1]], ["tile_x", "sp", [1, 1, 8, 1]], ["tile_rc", "sp", [32, 64]], ["tile_rx", "sp", [1, 1]], ["tile_ry", "sp", [1, 1]], ["auto_unroll_max_step", "ot", 0], ["unroll_explicit", "ot", 0]]}], "r": [[8.448735867117118e-05], 0, 14.069890975952148, 1535426980.678347], "v": 0.1}
{"i": ["cuda -model=titanx", "topi_nn_conv2d", [["TENSOR", [1, 2048, 8, 8], "float32"], ["TENSOR", [320, 2048, 1, 1], "float32"], [1, 1], [0, 0], [1, 1], "NCHW", "float32"], {}, ["conv2d", [1, 2048, 8, 8, "float32"], [320, 2048, 1, 1, "float32"], [1, 1], [0, 0], [1, 1], "NCHW", "float32"], {"i": 5709779, "t": "direct", "c": null, "e": [["tile_f", "sp", [10, 1, 16, 2]], ["tile_y", "sp", [2, 1, 2, 2]], ["tile_x", "sp", [1, 1, 8, 1]], ["tile_rc", "sp", [32, 64]], ["tile_rx", "sp", [1, 1]], ["tile_ry", "sp", [1, 1]], ["auto_unroll_max_step", "ot", 0], ["unroll_explicit", "ot", 1]]}], "r": [[8.139676807712908e-05], 0, 3.966081380844116, 1535427983.421136], "v": 0.1}
{"i": ["cuda -model=titanx", "topi_nn_conv2d", [["TENSOR", [1, 1280, 8, 8], "float32"], ["TENSOR", [192, 1280, 1, 1], "float32"], [1, 1], [0, 0], [1, 1], "NCHW", "float32"], {}, ["conv2d", [1, 1280, 8, 8, "float32"], [192, 1280, 1, 1, "float32"], [1, 1], [0, 0], [1, 1], "NCHW", "float32"], {"i": 13233096, "t": "direct", "c": null, "e": [["tile_f", "sp", [6, 1, 32, 1]], ["tile_y", "sp", [4, 1, 2, 1]], ["tile_x", "sp", [1, 1, 8, 1]], ["tile_rc", "sp", [40, 32]], ["tile_rx", "sp", [1, 1]], ["tile_ry", "sp", [1, 1]], ["auto_unroll_max_step", "ot", 1500], ["unroll_explicit", "ot", 1]]}], "r": [[3.6700240116420085e-05], 0, 3.608333110809326, 1535429000.509115], "v": 0.1}
{"i": ["cuda -model=titanx", "topi_nn_conv2d", [["TENSOR", [1, 448, 8, 8], "float32"], ["TENSOR", [384, 448, 3, 3], "float32"], [1, 1], [1, 1], [1, 1], "NCHW", "float32"], {}, ["conv2d", [1, 448, 8, 8, "float32"], [384, 448, 3, 3, "float32"], [1, 1], [1, 1], [1, 1], "NCHW", "float32"], {"i": 232980, "t": "winograd", "c": null, "e": [["tile_b", "sp", [36, 1, 1, 1]], ["tile_y", "sp", [6, 1, 32, 2]], ["tile_x", "sp", [1, 1, 4, 1]], ["tile_rc", "sp", [28, 16]], ["auto_unroll_max_step", "ot", 0], ["unroll_explicit", "ot", 1]]}], "r": [[0.00011755589655172413], 0, 5.878081798553467, 1535431279.4730268], "v": 0.1}
{"i": ["cuda -model=titanx", "topi_nn_conv2d", [["TENSOR", [1, 1280, 8, 8], "float32"], ["TENSOR", [448, 1280, 1, 1], "float32"], [1, 1], [0, 0], [1, 1], "NCHW", "float32"], {}, ["conv2d", [1, 1280, 8, 8, "float32"], [448, 1280, 1, 1, "float32"], [1, 1], [0, 0], [1, 1], "NCHW", "float32"], {"i": 3731075, "t": "direct", "c": null, "e": [["tile_f", "sp", [14, 1, 16, 2]], ["tile_y", "sp", [4, 1, 2, 1]], ["tile_x", "sp", [1, 1, 4, 2]], ["tile_rc", "sp", [32, 40]], ["tile_rx", "sp", [1, 1]], ["tile_ry", "sp", [1, 1]], ["auto_unroll_max_step", "ot", 512], ["unroll_explicit", "ot", 0]]}], "r": [[5.2090259632072194e-05], 0, 1.3185603618621826, 1535433032.3829937], "v": 0.1}
{"i": ["cuda -model=titanx", "topi_nn_conv2d", [["TENSOR", [1, 384, 8, 8], "float32"], ["TENSOR", [384, 384, 3, 1], "float32"], [1, 1], [1, 0], [1, 1], "NCHW", "float32"], {}, ["conv2d", [1, 384, 8, 8, "float32"], [384, 384, 3, 1, "float32"], [1, 1], [1, 0], [1, 1], "NCHW", "float32"], {"i": 35416378, "t": "direct", "c": null, "e": [["tile_f", "sp", [24, 2, 8, 1]], ["tile_y", "sp", [4, 1, 2, 1]], ["tile_x", "sp", [1, 1, 8, 1]], ["tile_rc", "sp", [16, 24]], ["tile_rx", "sp", [1, 3]], ["tile_ry", "sp", [1, 1]], ["auto_unroll_max_step", "ot", 1500], ["unroll_explicit", "ot", 1]]}], "r": [[4.5191243902439025e-05], 0, 1.303452730178833, 1535434456.1185555], "v": 0.1}
{"i": ["cuda -model=titanx", "topi_nn_conv2d", [["TENSOR", [1, 384, 8, 8], "float32"], ["TENSOR", [384, 384, 1, 3], "float32"], [1, 1], [0, 1], [1, 1], "NCHW", "float32"], {}, ["conv2d", [1, 384, 8, 8, "float32"], [384, 384, 1, 3, "float32"], [1, 1], [0, 1], [1, 1], "NCHW", "float32"], {"i": 13970090, "t": "direct", "c": null, "e": [["tile_f", "sp", [12, 1, 16, 2]], ["tile_y", "sp", [4, 1, 2, 1]], ["tile_x", "sp", [1, 1, 4, 2]], ["tile_rc", "sp", [16, 24]], ["tile_rx", "sp", [1, 1]], ["tile_ry", "sp", [3, 1]], ["auto_unroll_max_step", "ot", 1500], ["unroll_explicit", "ot", 0]]}], "r": [[4.3322369696969696e-05], 0, 1.4410252571105957, 1535436450.3439708], "v": 0.1}
{"i": ["cuda -model=titanx", "topi_nn_conv2d", [["TENSOR", [1, 1280, 8, 8], "float32"], ["TENSOR", [384, 1280, 1, 1], "float32"], [1, 1], [0, 0], [1, 1], "NCHW", "float32"], {}, ["conv2d", [1, 1280, 8, 8, "float32"], [384, 1280, 1, 1, "float32"], [1, 1], [0, 0], [1, 1], "NCHW", "float32"], {"i": 5330090, "t": "direct", "c": null, "e": [["tile_f", "sp", [12, 1, 16, 2]], ["tile_y", "sp", [4, 1, 2, 1]], ["tile_x", "sp", [1, 1, 4, 2]], ["tile_rc", "sp", [32, 40]], ["tile_rx", "sp", [1, 1]], ["tile_ry", "sp", [1, 1]], ["auto_unroll_max_step", "ot", 512], ["unroll_explicit", "ot", 0]]}], "r": [[4.552532625833839e-05], 0, 1.3521144390106201, 1535437568.5237384], "v": 0.1}
{"i": ["cuda -model=titanx", "topi_nn_conv2d", [["TENSOR", [1, 1280, 8, 8], "float32"], ["TENSOR", [320, 1280, 1, 1], "float32"], [1, 1], [0, 0], [1, 1], "NCHW", "float32"], {}, ["conv2d", [1, 1280, 8, 8, "float32"], [320, 1280, 1, 1, "float32"], [1, 1], [0, 0], [1, 1], "NCHW", "float32"], {"i": 3690668, "t": "direct", "c": null, "e": [["tile_f", "sp", [20, 2, 8, 1]], ["tile_y", "sp", [4, 1, 2, 1]], ["tile_x", "sp", [1, 1, 8, 1]], ["tile_rc", "sp", [32, 40]], ["tile_rx", "sp", [1, 1]], ["tile_ry", "sp", [1, 1]], ["auto_unroll_max_step", "ot", 512], ["unroll_explicit", "ot", 0]]}], "r": [[4.795118104265403e-05], 0, 1.2909648418426514, 1535438405.1098573], "v": 0.1}
{"i": ["cuda -model=titanx", "topi_nn_conv2d", [["TENSOR", [1, 192, 17, 17], "float32"], ["TENSOR", [192, 192, 3, 3], "float32"], [2, 2], [0, 0], [1, 1], "NCHW", "float32"], {}, ["conv2d", [1, 192, 17, 17, "float32"], [192, 192, 3, 3, "float32"], [2, 2], [0, 0], [1, 1], "NCHW", "float32"], {"i": 10006142, "t": "direct", "c": null, "e": [["tile_f", "sp", [12, 1, 16, 1]], ["tile_y", "sp", [8, 1, 1, 1]], ["tile_x", "sp", [1, 1, 8, 1]], ["tile_rc", "sp", [32, 6]], ["tile_rx", "sp", [1, 3]], ["tile_ry", "sp", [3, 1]], ["auto_unroll_max_step", "ot", 512], ["unroll_explicit", "ot", 0]]}], "r": [[5.094121392190153e-05], 0, 1.2878923416137695, 1535439480.1925032], "v": 0.1}
{"i": ["cuda -model=titanx", "topi_nn_conv2d", [["TENSOR", [1, 192, 17, 17], "float32"], ["TENSOR", [320, 192, 3, 3], "float32"], [2, 2], [0, 0], [1, 1], "NCHW", "float32"], {}, ["conv2d", [1, 192, 17, 17, "float32"], [320, 192, 3, 3, "float32"], [2, 2], [0, 0], [1, 1], "NCHW", "float32"], {"i": 28729475, "t": "direct", "c": null, "e": [["tile_f", "sp", [10, 1, 16, 2]], ["tile_y", "sp", [4, 1, 2, 1]], ["tile_x", "sp", [1, 1, 4, 2]], ["tile_rc", "sp", [48, 4]], ["tile_rx", "sp", [1, 3]], ["tile_ry", "sp", [1, 3]], ["auto_unroll_max_step", "ot", 0], ["unroll_explicit", "ot", 1]]}], "r": [[6.494733763996555e-05], 0, 1.3043124675750732, 1535440944.6158926], "v": 0.1}
{"i": ["cuda -model=titanx", "topi_nn_conv2d", [["TENSOR", [1, 192, 17, 17], "float32"], ["TENSOR", [192, 192, 7, 1], "float32"], [1, 1], [3, 0], [1, 1], "NCHW", "float32"], {}, ["conv2d", [1, 192, 17, 17, "float32"], [192, 192, 7, 1, "float32"], [1, 1], [3, 0], [1, 1], "NCHW", "float32"], {"i": 776877, "t": "direct", "c": null, "e": [["tile_f", "sp", [8, 4, 6, 1]], ["tile_y", "sp", [17, 1, 1, 1]], ["tile_x", "sp", [1, 1, 17, 1]], ["tile_rc", "sp", [32, 6]], ["tile_rx", "sp", [7, 1]], ["tile_ry", "sp", [1, 1]], ["auto_unroll_max_step", "ot", 1500], ["unroll_explicit", "ot", 1]]}], "r": [[0.00016294033007600435], 0, 2.581367254257202, 1535441832.1955879], "v": 0.1}
{"i": ["cuda -model=titanx", "topi_nn_conv2d", [["TENSOR", [1, 192, 17, 17], "float32"], ["TENSOR", [192, 192, 1, 7], "float32"], [1, 1], [0, 3], [1, 1], "NCHW", "float32"], {}, ["conv2d", [1, 192, 17, 17, "float32"], [192, 192, 1, 7, "float32"], [1, 1], [0, 3], [1, 1], "NCHW", "float32"], {"i": 325452, "t": "direct", "c": null, "e": [["tile_f", "sp", [8, 1, 6, 4]], ["tile_y", "sp", [17, 1, 1, 1]], ["tile_x", "sp", [1, 1, 17, 1]], ["tile_rc", "sp", [32, 6]], ["tile_rx", "sp", [1, 1]], ["tile_ry", "sp", [7, 1]], ["auto_unroll_max_step", "ot", 1500], ["unroll_explicit", "ot", 0]]}], "r": [[0.00016267638502673795], 0, 1.3517541885375977, 1535442556.6070833], "v": 0.1}
{"i": ["cuda -model=titanx", "topi_nn_conv2d", [["TENSOR", [1, 160, 17, 17], "float32"], ["TENSOR", [192, 160, 1, 7], "float32"], [1, 1], [0, 3], [1, 1], "NCHW", "float32"], {}, ["conv2d", [1, 160, 17, 17, "float32"], [192, 160, 1, 7, "float32"], [1, 1], [0, 3], [1, 1], "NCHW", "float32"], {"i": 88756, "t": "direct", "c": null, "e": [["tile_f", "sp", [6, 4, 8, 1]], ["tile_y", "sp", [17, 1, 1, 1]], ["tile_x", "sp", [1, 1, 17, 1]], ["tile_rc", "sp", [20, 8]], ["tile_rx", "sp", [1, 1]], ["tile_ry", "sp", [1, 7]], ["auto_unroll_max_step", "ot", 0], ["unroll_explicit", "ot", 0]]}], "r": [[0.00014167337005649717], 0, 2.514183282852173, 1535443548.5128298], "v": 0.1}
{"i": ["cuda -model=titanx", "topi_nn_conv2d", [["TENSOR", [1, 160, 17, 17], "float32"], ["TENSOR", [160, 160, 7, 1], "float32"], [1, 1], [3, 0], [1, 1], "NCHW", "float32"], {}, ["conv2d", [1, 160, 17, 17, "float32"], [160, 160, 7, 1, "float32"], [1, 1], [3, 0], [1, 1], "NCHW", "float32"], {"i": 449924, "t": "direct", "c": null, "e": [["tile_f", "sp", [4, 1, 10, 4]], ["tile_y", "sp", [17, 1, 1, 1]], ["tile_x", "sp", [1, 1, 17, 1]], ["tile_rc", "sp", [16, 10]], ["tile_rx", "sp", [7, 1]], ["tile_ry", "sp", [1, 1]], ["auto_unroll_max_step", "ot", 1500], ["unroll_explicit", "ot", 1]]}], "r": [[0.00011452480775075988], 0, 4.953140497207642, 1535444579.1761086], "v": 0.1}
{"i": ["cuda -model=titanx", "topi_nn_conv2d", [["TENSOR", [1, 160, 17, 17], "float32"], ["TENSOR", [192, 160, 7, 1], "float32"], [1, 1], [3, 0], [1, 1], "NCHW", "float32"], {}, ["conv2d", [1, 160, 17, 17, "float32"], [192, 160, 7, 1, "float32"], [1, 1], [3, 0], [1, 1], "NCHW", "float32"], {"i": 669438, "t": "direct", "c": null, "e": [["tile_f", "sp", [6, 2, 8, 2]], ["tile_y", "sp", [17, 1, 1, 1]], ["tile_x", "sp", [1, 1, 17, 1]], ["tile_rc", "sp", [20, 8]], ["tile_rx", "sp", [7, 1]], ["tile_ry", "sp", [1, 1]], ["auto_unroll_max_step", "ot", 1500], ["unroll_explicit", "ot", 1]]}], "r": [[0.00014245359474671668], 0, 3.571627140045166, 1535445303.0586505], "v": 0.1}
{"i": ["cuda -model=titanx", "topi_nn_conv2d", [["TENSOR", [1, 160, 17, 17], "float32"], ["TENSOR", [160, 160, 1, 7], "float32"], [1, 1], [0, 3], [1, 1], "NCHW", "float32"], {}, ["conv2d", [1, 160, 17, 17, "float32"], [160, 160, 1, 7, "float32"], [1, 1], [0, 3], [1, 1], "NCHW", "float32"], {"i": 446246, "t": "direct", "c": null, "e": [["tile_f", "sp", [5, 4, 8, 1]], ["tile_y", "sp", [17, 1, 1, 1]], ["tile_x", "sp", [1, 1, 17, 1]], ["tile_rc", "sp", [20, 8]], ["tile_rx", "sp", [1, 1]], ["tile_ry", "sp", [7, 1]], ["auto_unroll_max_step", "ot", 1500], ["unroll_explicit", "ot", 1]]}], "r": [[0.00011218677481481482], 0, 1.3602855205535889, 1535446031.3722363], "v": 0.1}
{"i": ["cuda -model=titanx", "topi_nn_conv2d", [["TENSOR", [1, 768, 17, 17], "float32"], ["TENSOR", [160, 768, 1, 1], "float32"], [1, 1], [0, 0], [1, 1], "NCHW", "float32"], {}, ["conv2d", [1, 768, 17, 17, "float32"], [160, 768, 1, 1, "float32"], [1, 1], [0, 0], [1, 1], "NCHW", "float32"], {"i": 220455, "t": "direct", "c": null, "e": [["tile_f", "sp", [4, 5, 8, 1]], ["tile_y", "sp", [17, 1, 1, 1]], ["tile_x", "sp", [1, 1, 17, 1]], ["tile_rc", "sp", [48, 16]], ["tile_rx", "sp", [1, 1]], ["tile_ry", "sp", [1, 1]], ["auto_unroll_max_step", "ot", 0], ["unroll_explicit", "ot", 1]]}], "r": [[7.427650495049505e-05], 0, 1.2197649478912354, 1535446918.1282773], "v": 0.1}
{"i": ["cuda -model=titanx", "topi_nn_conv2d", [["TENSOR", [1, 128, 17, 17], "float32"], ["TENSOR", [192, 128, 1, 7], "float32"], [1, 1], [0, 3], [1, 1], "NCHW", "float32"], {}, ["conv2d", [1, 128, 17, 17, "float32"], [192, 128, 1, 7, "float32"], [1, 1], [0, 3], [1, 1], "NCHW", "float32"], {"i": 61876, "t": "direct", "c": null, "e": [["tile_f", "sp", [6, 4, 8, 1]], ["tile_y", "sp", [17, 1, 1, 1]], ["tile_x", "sp", [1, 1, 17, 1]], ["tile_rc", "sp", [16, 8]], ["tile_rx", "sp", [1, 1]], ["tile_ry", "sp", [1, 7]], ["auto_unroll_max_step", "ot", 0], ["unroll_explicit", "ot", 0]]}], "r": [[0.00011426011119573495], 0, 18.739489793777466, 1535447697.4223692], "v": 0.1}
{"i": ["cuda -model=titanx", "topi_nn_conv2d", [["TENSOR", [1, 128, 17, 17], "float32"], ["TENSOR", [128, 128, 7, 1], "float32"], [1, 1], [3, 0], [1, 1], "NCHW", "float32"], {}, ["conv2d", [1, 128, 17, 17, "float32"], [128, 128, 7, 1, "float32"], [1, 1], [3, 0], [1, 1], "NCHW", "float32"], {"i": 129655, "t": "direct", "c": null, "e": [["tile_f", "sp", [4, 2, 8, 2]], ["tile_y", "sp", [17, 1, 1, 1]], ["tile_x", "sp", [1, 1, 17, 1]], ["tile_rc", "sp", [16, 8]], ["tile_rx", "sp", [7, 1]], ["tile_ry", "sp", [1, 1]], ["auto_unroll_max_step", "ot", 512], ["unroll_explicit", "ot", 1]]}], "r": [[7.613525476429288e-05], 0, 8.062903881072998, 1535448397.9567559], "v": 0.1}
{"i": ["cuda -model=titanx", "topi_nn_conv2d", [["TENSOR", [1, 128, 17, 17], "float32"], ["TENSOR", [192, 128, 7, 1], "float32"], [1, 1], [3, 0], [1, 1], "NCHW", "float32"], {}, ["conv2d", [1, 128, 17, 17, "float32"], [192, 128, 7, 1, "float32"], [1, 1], [3, 0], [1, 1], "NCHW", "float32"], {"i": 448948, "t": "direct", "c": null, "e": [["tile_f", "sp", [6, 4, 8, 1]], ["tile_y", "sp", [17, 1, 1, 1]], ["tile_x", "sp", [1, 1, 17, 1]], ["tile_rc", "sp", [16, 8]], ["tile_rx", "sp", [7, 1]], ["tile_ry", "sp", [1, 1]], ["auto_unroll_max_step", "ot", 1500], ["unroll_explicit", "ot", 1]]}], "r": [[0.00011292374210526315], 0, 2.1787657737731934, 1535449108.6007366], "v": 0.1}
{"i": ["cuda -model=titanx", "topi_nn_conv2d", [["TENSOR", [1, 128, 17, 17], "float32"], ["TENSOR", [128, 128, 1, 7], "float32"], [1, 1], [0, 3], [1, 1], "NCHW", "float32"], {}, ["conv2d", [1, 128, 17, 17, "float32"], [128, 128, 1, 7, "float32"], [1, 1], [0, 3], [1, 1], "NCHW", "float32"], {"i": 129623, "t": "direct", "c": null, "e": [["tile_f", "sp", [4, 4, 8, 1]], ["tile_y", "sp", [17, 1, 1, 1]], ["tile_x", "sp", [1, 1, 17, 1]], ["tile_rc", "sp", [16, 8]], ["tile_rx", "sp", [1, 1]], ["tile_ry", "sp", [7, 1]], ["auto_unroll_max_step", "ot", 512], ["unroll_explicit", "ot", 1]]}], "r": [[7.355220323212537e-05], 0, 3.0357697010040283, 1535449805.546825], "v": 0.1}
{"i": ["cuda -model=titanx", "topi_nn_conv2d", [["TENSOR", [1, 768, 17, 17], "float32"], ["TENSOR", [128, 768, 1, 1], "float32"], [1, 1], [0, 0], [1, 1], "NCHW", "float32"], {}, ["conv2d", [1, 768, 17, 17, "float32"], [128, 768, 1, 1, "float32"], [1, 1], [0, 0], [1, 1], "NCHW", "float32"], {"i": 120055, "t": "direct", "c": null, "e": [["tile_f", "sp", [4, 2, 8, 2]], ["tile_y", "sp", [17, 1, 1, 1]], ["tile_x", "sp", [1, 1, 17, 1]], ["tile_rc", "sp", [32, 24]], ["tile_rx", "sp", [1, 1]], ["tile_ry", "sp", [1, 1]], ["auto_unroll_max_step", "ot", 0], ["unroll_explicit", "ot", 1]]}], "r": [[6.593256546572935e-05], 0, 10.24105978012085, 1535450762.5778947], "v": 0.1}
{"i": ["cuda -model=titanx", "topi_nn_conv2d", [["TENSOR", [1, 768, 17, 17], "float32"], ["TENSOR", [192, 768, 1, 1], "float32"], [1, 1], [0, 0], [1, 1], "NCHW", "float32"], {}, ["conv2d", [1, 768, 17, 17, "float32"], [192, 768, 1, 1, "float32"], [1, 1], [0, 0], [1, 1], "NCHW", "float32"], {"i": 228674, "t": "direct", "c": null, "e": [["tile_f", "sp", [8, 2, 3, 4]], ["tile_y", "sp", [17, 1, 1, 1]], ["tile_x", "sp", [1, 1, 17, 1]], ["tile_rc", "sp", [64, 12]], ["tile_rx", "sp", [1, 1]], ["tile_ry", "sp", [1, 1]], ["auto_unroll_max_step", "ot", 1500], ["unroll_explicit", "ot", 0]]}], "r": [[8.298381360619469e-05], 0, 1.2305030822753906, 1535452260.8384964], "v": 0.1}
{"i": ["cuda -model=titanx", "topi_nn_conv2d", [["TENSOR", [1, 96, 35, 35], "float32"], ["TENSOR", [96, 96, 3, 3], "float32"], [2, 2], [0, 0], [1, 1], "NCHW", "float32"], {}, ["conv2d", [1, 96, 35, 35, "float32"], [96, 96, 3, 3, "float32"], [2, 2], [0, 0], [1, 1], "NCHW", "float32"], {"i": 227677, "t": "direct", "c": null, "e": [["tile_f", "sp", [4, 2, 6, 2]], ["tile_y", "sp", [17, 1, 1, 1]], ["tile_x", "sp", [1, 1, 17, 1]], ["tile_rc", "sp", [24, 4]], ["tile_rx", "sp", [1, 3]], ["tile_ry", "sp", [3, 1]], ["auto_unroll_max_step", "ot", 512], ["unroll_explicit", "ot", 0]]}], "r": [[6.262685946622186e-05], 0, 2.3495943546295166, 1535453153.0011835], "v": 0.1}
{"i": ["cuda -model=titanx", "topi_nn_conv2d", [["TENSOR", [1, 288, 35, 35], "float32"], ["TENSOR", [384, 288, 3, 3], "float32"], [2, 2], [0, 0], [1, 1], "NCHW", "float32"], {}, ["conv2d", [1, 288, 35, 35, "float32"], [384, 288, 3, 3, "float32"], [2, 2], [0, 0], [1, 1], "NCHW", "float32"], {"i": 426376, "t": "direct", "c": null, "e": [["tile_f", "sp", [16, 4, 3, 2]], ["tile_y", "sp", [17, 1, 1, 1]], ["tile_x", "sp", [1, 1, 17, 1]], ["tile_rc", "sp", [144, 2]], ["tile_rx", "sp", [1, 3]], ["tile_ry", "sp", [1, 3]], ["auto_unroll_max_step", "ot", 0], ["unroll_explicit", "ot", 0]]}], "r": [[0.00046931365937500003], 0, 5.672942876815796, 1535454505.8647752], "v": 0.1}
{"i": ["cuda -model=titanx", "topi_nn_conv2d", [["TENSOR", [1, 288, 35, 35], "float32"], ["TENSOR", [48, 288, 1, 1], "float32"], [1, 1], [0, 0], [1, 1], "NCHW", "float32"], {}, ["conv2d", [1, 288, 35, 35, "float32"], [48, 288, 1, 1, "float32"], [1, 1], [0, 0], [1, 1], "NCHW", "float32"], {"i": 2956827, "t": "direct", "c": null, "e": [["tile_f", "sp", [2, 6, 4, 1]], ["tile_y", "sp", [35, 1, 1, 1]], ["tile_x", "sp", [1, 1, 35, 1]], ["tile_rc", "sp", [12, 24]], ["tile_rx", "sp", [1, 1]], ["tile_ry", "sp", [1, 1]], ["auto_unroll_max_step", "ot", 512], ["unroll_explicit", "ot", 1]]}], "r": [[3.304847466960352e-05], 0, 9.784206628799438, 1535455827.5935478], "v": 0.1}
{"i": ["cuda -model=titanx", "topi_nn_conv2d", [["TENSOR", [1, 288, 35, 35], "float32"], ["TENSOR", [64, 288, 1, 1], "float32"], [1, 1], [0, 0], [1, 1], "NCHW", "float32"], {}, ["conv2d", [1, 288, 35, 35, "float32"], [64, 288, 1, 1, "float32"], [1, 1], [0, 0], [1, 1], "NCHW", "float32"], {"i": 225833, "t": "direct", "c": null, "e": [["tile_f", "sp", [2, 4, 4, 2]], ["tile_y", "sp", [35, 1, 1, 1]], ["tile_x", "sp", [1, 1, 35, 1]], ["tile_rc", "sp", [12, 24]], ["tile_rx", "sp", [1, 1]], ["tile_ry", "sp", [1, 1]], ["auto_unroll_max_step", "ot", 0], ["unroll_explicit", "ot", 0]]}], "r": [[3.915220448617632e-05], 0, 1.400207281112671, 1535456732.6478782], "v": 0.1}
{"i": ["cuda -model=titanx", "topi_nn_conv2d", [["TENSOR", [1, 256, 35, 35], "float32"], ["TENSOR", [48, 256, 1, 1], "float32"], [1, 1], [0, 0], [1, 1], "NCHW", "float32"], {}, ["conv2d", [1, 256, 35, 35, "float32"], [48, 256, 1, 1, "float32"], [1, 1], [0, 0], [1, 1], "NCHW", "float32"], {"i": 1129045, "t": "direct", "c": null, "e": [["tile_f", "sp", [2, 2, 4, 3]], ["tile_y", "sp", [35, 1, 1, 1]], ["tile_x", "sp", [1, 1, 35, 1]], ["tile_rc", "sp", [16, 16]], ["tile_rx", "sp", [1, 1]], ["tile_ry", "sp", [1, 1]], ["auto_unroll_max_step", "ot", 0], ["unroll_explicit", "ot", 1]]}], "r": [[3.0527908595641644e-05], 0, 2.0959362983703613, 1535457623.5808153], "v": 0.1}
{"i": ["cuda -model=titanx", "topi_nn_conv2d", [["TENSOR", [1, 256, 35, 35], "float32"], ["TENSOR", [64, 256, 1, 1], "float32"], [1, 1], [0, 0], [1, 1], "NCHW", "float32"], {}, ["conv2d", [1, 256, 35, 35, "float32"], [64, 256, 1, 1, "float32"], [1, 1], [0, 0], [1, 1], "NCHW", "float32"], {"i": 462356, "t": "direct", "c": null, "e": [["tile_f", "sp", [2, 4, 8, 1]], ["tile_y", "sp", [35, 1, 1, 1]], ["tile_x", "sp", [1, 1, 35, 1]], ["tile_rc", "sp", [32, 8]], ["tile_rx", "sp", [1, 1]], ["tile_ry", "sp", [1, 1]], ["auto_unroll_max_step", "ot", 1500], ["unroll_explicit", "ot", 0]]}], "r": [[3.608307039884671e-05], 0, 7.058563470840454, 1535458449.1994894], "v": 0.1}
{"i": ["cuda -model=titanx", "topi_nn_conv2d", [["TENSOR", [1, 192, 35, 35], "float32"], ["TENSOR", [32, 192, 1, 1], "float32"], [1, 1], [0, 0], [1, 1], "NCHW", "float32"], {}, ["conv2d", [1, 192, 35, 35, "float32"], [32, 192, 1, 1, "float32"], [1, 1], [0, 0], [1, 1], "NCHW", "float32"], {"i": 322573, "t": "direct", "c": null, "e": [["tile_f", "sp", [2, 4, 4, 1]], ["tile_y", "sp", [35, 1, 1, 1]], ["tile_x", "sp", [1, 1, 35, 1]], ["tile_rc", "sp", [8, 24]], ["tile_rx", "sp", [1, 1]], ["tile_ry", "sp", [1, 1]], ["auto_unroll_max_step", "ot", 512], ["unroll_explicit", "ot", 0]]}], "r": [[1.7956799473873014e-05], 0, 1.3385558128356934, 1535459233.2346888], "v": 0.1}
{"i": ["cuda -model=titanx", "topi_nn_conv2d", [["TENSOR", [1, 96, 35, 35], "float32"], ["TENSOR", [96, 96, 3, 3], "float32"], [1, 1], [1, 1], [1, 1], "NCHW", "float32"], {}, ["conv2d", [1, 96, 35, 35, "float32"], [96, 96, 3, 3, "float32"], [1, 1], [1, 1], [1, 1], "NCHW", "float32"], {"i": 1352202, "t": "winograd", "c": null, "e": [["tile_b", "sp", [16, 1, 1, 1]], ["tile_y", "sp", [6, 2, 2, 4]], ["tile_x", "sp", [1, 3, 108, 1]], ["tile_rc", "sp", [12, 8]], ["auto_unroll_max_step", "ot", 128], ["unroll_explicit", "ot", 0]]}], "r": [[5.601382798507463e-05], 0, 11.555405378341675, 1535461246.940517], "v": 0.1}
{"i": ["cuda -model=titanx", "topi_nn_conv2d", [["TENSOR", [1, 64, 35, 35], "float32"], ["TENSOR", [96, 64, 3, 3], "float32"], [1, 1], [1, 1], [1, 1], "NCHW", "float32"], {}, ["conv2d", [1, 64, 35, 35, "float32"], [96, 64, 3, 3, "float32"], [1, 1], [1, 1], [1, 1], "NCHW", "float32"], {"i": 1901044, "t": "winograd", "c": null, "e": [["tile_b", "sp", [16, 1, 1, 1]], ["tile_y", "sp", [6, 1, 2, 8]], ["tile_x", "sp", [1, 3, 108, 1]], ["tile_rc", "sp", [8, 8]], ["auto_unroll_max_step", "ot", 0], ["unroll_explicit", "ot", 1]]}], "r": [[4.3254536418166237e-05], 0, 1.3233392238616943, 1535463738.0164495], "v": 0.1}
{"i": ["cuda -model=titanx", "topi_nn_conv2d", [["TENSOR", [1, 48, 35, 35], "float32"], ["TENSOR", [64, 48, 5, 5], "float32"], [1, 1], [2, 2], [1, 1], "NCHW", "float32"], {}, ["conv2d", [1, 48, 35, 35, "float32"], [64, 48, 5, 5, "float32"], [1, 1], [2, 2], [1, 1], "NCHW", "float32"], {"i": 3275017, "t": "direct", "c": null, "e": [["tile_f", "sp", [2, 1, 32, 1]], ["tile_y", "sp", [5, 1, 1, 7]], ["tile_x", "sp", [7, 1, 5, 1]], ["tile_rc", "sp", [16, 3]], ["tile_rx", "sp", [1, 5]], ["tile_ry", "sp", [1, 5]], ["auto_unroll_max_step", "ot", 0], ["unroll_explicit", "ot", 1]]}], "r": [[7.947820815677967e-05], 0, 1.3620657920837402, 1535466035.195244], "v": 0.1}
{"i": ["cuda -model=titanx", "topi_nn_conv2d", [["TENSOR", [1, 192, 35, 35], "float32"], ["TENSOR", [48, 192, 1, 1], "float32"], [1, 1], [0, 0], [1, 1], "NCHW", "float32"], {}, ["conv2d", [1, 192, 35, 35, "float32"], [48, 192, 1, 1, "float32"], [1, 1], [0, 0], [1, 1], "NCHW", "float32"], {"i": 1774165, "t": "direct", "c": null, "e": [["tile_f", "sp", [2, 2, 4, 3]], ["tile_y", "sp", [35, 1, 1, 1]], ["tile_x", "sp", [1, 1, 35, 1]], ["tile_rc", "sp", [12, 16]], ["tile_rx", "sp", [1, 1]], ["tile_ry", "sp", [1, 1]], ["auto_unroll_max_step", "ot", 0], ["unroll_explicit", "ot", 1]]}], "r": [[2.3459930018703244e-05], 0, 4.270485162734985, 1535466912.1237135], "v": 0.1}
{"i": ["cuda -model=titanx", "topi_nn_conv2d", [["TENSOR", [1, 192, 35, 35], "float32"], ["TENSOR", [64, 192, 1, 1], "float32"], [1, 1], [0, 0], [1, 1], "NCHW", "float32"], {}, ["conv2d", [1, 192, 35, 35, "float32"], [64, 192, 1, 1, "float32"], [1, 1], [0, 0], [1, 1], "NCHW", "float32"], {"i": 1085972, "t": "direct", "c": null, "e": [["tile_f", "sp", [2, 4, 8, 1]], ["tile_y", "sp", [35, 1, 1, 1]], ["tile_x", "sp", [1, 1, 35, 1]], ["tile_rc", "sp", [8, 24]], ["tile_rx", "sp", [1, 1]], ["tile_ry", "sp", [1, 1]], ["auto_unroll_max_step", "ot", 0], ["unroll_explicit", "ot", 1]]}], "r": [[2.796061236268851e-05], 0, 1.4543447494506836, 1535467856.116219], "v": 0.1}
{"i": ["cuda -model=titanx", "topi_nn_conv2d", [["TENSOR", [1, 80, 73, 73], "float32"], ["TENSOR", [192, 80, 3, 3], "float32"], [1, 1], [0, 0], [1, 1], "NCHW", "float32"], {}, ["conv2d", [1, 80, 73, 73, "float32"], [192, 80, 3, 3, "float32"], [1, 1], [0, 0], [1, 1], "NCHW", "float32"], {"i": 922093, "t": "direct", "c": null, "e": [["tile_f", "sp", [4, 8, 3, 2]], ["tile_y", "sp", [71, 1, 1, 1]], ["tile_x", "sp", [1, 1, 71, 1]], ["tile_rc", "sp", [40, 2]], ["tile_rx", "sp", [1, 3]], ["tile_ry", "sp", [3, 1]], ["auto_unroll_max_step", "ot", 512], ["unroll_explicit", "ot", 1]]}], "r": [[0.0006553213608695652], 0, 1.5329456329345703, 1535470367.360386], "v": 0.1}
{"i": ["cuda -model=titanx", "topi_nn_conv2d", [["TENSOR", [1, 64, 73, 73], "float32"], ["TENSOR", [80, 64, 1, 1], "float32"], [1, 1], [0, 0], [1, 1], "NCHW", "float32"], {}, ["conv2d", [1, 64, 73, 73, "float32"], [80, 64, 1, 1, "float32"], [1, 1], [0, 0], [1, 1], "NCHW", "float32"], {"i": 70574, "t": "direct", "c": null, "e": [["tile_f", "sp", [5, 8, 2, 1]], ["tile_y", "sp", [73, 1, 1, 1]], ["tile_x", "sp", [1, 1, 73, 1]], ["tile_rc", "sp", [8, 8]], ["tile_rx", "sp", [1, 1]], ["tile_ry", "sp", [1, 1]], ["auto_unroll_max_step", "ot", 512], ["unroll_explicit", "ot", 1]]}], "r": [[3.883320232858991e-05], 0, 1.5573954582214355, 1535471271.1996536], "v": 0.1}
{"i": ["cuda -model=titanx", "topi_nn_conv2d", [["TENSOR", [1, 32, 147, 147], "float32"], ["TENSOR", [64, 32, 3, 3], "float32"], [1, 1], [1, 1], [1, 1], "NCHW", "float32"], {}, ["conv2d", [1, 32, 147, 147, "float32"], [64, 32, 3, 3, "float32"], [1, 1], [1, 1], [1, 1], "NCHW", "float32"], {"i": 8943001, "t": "direct", "c": null, "e": [["tile_f", "sp", [2, 1, 32, 1]], ["tile_y", "sp", [21, 1, 1, 7]], ["tile_x", "sp", [7, 1, 7, 3]], ["tile_rc", "sp", [32, 1]], ["tile_rx", "sp", [1, 3]], ["tile_ry", "sp", [1, 3]], ["auto_unroll_max_step", "ot", 1500], ["unroll_explicit", "ot", 0]]}], "r": [[0.00025052284166666663], 0, 7.156659126281738, 1535472591.5201485], "v": 0.1}
{"i": ["cuda -model=titanx", "topi_nn_conv2d", [["TENSOR", [1, 32, 149, 149], "float32"], ["TENSOR", [32, 32, 3, 3], "float32"], [1, 1], [0, 0], [1, 1], "NCHW", "float32"], {}, ["conv2d", [1, 32, 149, 149, "float32"], [32, 32, 3, 3, "float32"], [1, 1], [0, 0], [1, 1], "NCHW", "float32"], {"i": 6050372, "t": "direct", "c": null, "e": [["tile_f", "sp", [1, 1, 32, 1]], ["tile_y", "sp", [21, 7, 1, 1]], ["tile_x", "sp", [7, 1, 7, 3]], ["tile_rc", "sp", [16, 2]], ["tile_rx", "sp", [1, 3]], ["tile_ry", "sp", [1, 3]], ["auto_unroll_max_step", "ot", 1500], ["unroll_explicit", "ot", 0]]}], "r": [[0.00012198324857839155], 0, 3.08567214012146, 1535473653.6231658], "v": 0.1}
{"i": ["cuda -model=titanx", "topi_nn_conv2d", [["TENSOR", [1, 3, 299, 299], "float32"], ["TENSOR", [32, 3, 3, 3], "float32"], [2, 2], [0, 0], [1, 1], "NCHW", "float32"], {}, ["conv2d", [1, 3, 299, 299, "float32"], [32, 3, 3, 3, "float32"], [2, 2], [0, 0], [1, 1], "NCHW", "float32"], {"i": 23791, "t": "direct", "c": null, "e": [["tile_f", "sp", [2, 2, 1, 8]], ["tile_y", "sp", [149, 1, 1, 1]], ["tile_x", "sp", [1, 1, 149, 1]], ["tile_rc", "sp", [3, 1]], ["tile_rx", "sp", [1, 3]], ["tile_ry", "sp", [3, 1]], ["auto_unroll_max_step", "ot", 0], ["unroll_explicit", "ot", 1]]}], "r": [[3.216306946826758e-05], 0, 5.255294322967529, 1535474702.044478], "v": 0.1}
{"i": ["cuda -model=titanx", "topi_nn_conv2d", [["TENSOR", [1, 512, 14, 14], "float32"], ["TENSOR", [512, 512, 3, 3], "float32"], [1, 1], [1, 1], [1, 1], "NCHW", "float32"], {}, ["conv2d", [1, 512, 14, 14, "float32"], [512, 512, 3, 3, "float32"], [1, 1], [1, 1], [1, 1], "NCHW", "float32"], {"i": 117516, "t": "winograd", "c": null, "e": [["tile_b", "sp", [16, 1, 1, 1]], ["tile_y", "sp", [8, 4, 16, 1]], ["tile_x", "sp", [1, 7, 7, 1]], ["tile_rc", "sp", [64, 8]], ["auto_unroll_max_step", "ot", 1500], ["unroll_explicit", "ot", 1]]}], "r": [[0.00018763357], 0, 1.6003353595733643, 1535405501.9874778], "v": 0.1}
{"i": ["cuda -model=titanx", "topi_nn_conv2d", [["TENSOR", [1, 512, 28, 28], "float32"], ["TENSOR", [512, 512, 3, 3], "float32"], [1, 1], [1, 1], [1, 1], "NCHW", "float32"], {}, ["conv2d", [1, 512, 28, 28, "float32"], [512, 512, 3, 3, "float32"], [1, 1], [1, 1], [1, 1], "NCHW", "float32"], {"i": 1172502, "t": "winograd", "c": null, "e": [["tile_b", "sp", [16, 1, 1, 1]], ["tile_y", "sp", [8, 2, 8, 4]], ["tile_x", "sp", [1, 7, 28, 1]], ["tile_rc", "sp", [64, 8]], ["auto_unroll_max_step", "ot", 1500], ["unroll_explicit", "ot", 1]]}], "r": [[0.0005314307929824561], 0, 15.780593156814575, 1535406995.4651527], "v": 0.1}
{"i": ["cuda -model=titanx", "topi_nn_conv2d", [["TENSOR", [1, 256, 28, 28], "float32"], ["TENSOR", [512, 256, 3, 3], "float32"], [1, 1], [1, 1], [1, 1], "NCHW", "float32"], {}, ["conv2d", [1, 256, 28, 28, "float32"], [512, 256, 3, 3, "float32"], [1, 1], [1, 1], [1, 1], "NCHW", "float32"], {"i": 1062454, "t": "winograd", "c": null, "e": [["tile_b", "sp", [16, 1, 1, 1]], ["tile_y", "sp", [16, 4, 4, 2]], ["tile_x", "sp", [1, 7, 28, 1]], ["tile_rc", "sp", [32, 8]], ["auto_unroll_max_step", "ot", 1500], ["unroll_explicit", "ot", 1]]}], "r": [[0.0002953229862475442], 0, 1.9394707679748535, 1535408976.5928106], "v": 0.1}
{"i": ["cuda -model=titanx", "topi_nn_conv2d", [["TENSOR", [1, 256, 56, 56], "float32"], ["TENSOR", [256, 256, 3, 3], "float32"], [1, 1], [1, 1], [1, 1], "NCHW", "float32"], {}, ["conv2d", [1, 256, 56, 56, "float32"], [256, 256, 3, 3, "float32"], [1, 1], [1, 1], [1, 1], "NCHW", "float32"], {"i": 796885, "t": "winograd", "c": null, "e": [["tile_b", "sp", [36, 1, 1, 1]], ["tile_y", "sp", [4, 2, 8, 4]], ["tile_x", "sp", [1, 7, 28, 1]], ["tile_rc", "sp", [32, 8]], ["auto_unroll_max_step", "ot", 1500], ["unroll_explicit", "ot", 1]]}], "r": [[0.00037394815158924206], 0, 3.6207523345947266, 1535410469.9387088], "v": 0.1}
{"i": ["cuda -model=titanx", "topi_nn_conv2d", [["TENSOR", [1, 128, 56, 56], "float32"], ["TENSOR", [256, 128, 3, 3], "float32"], [1, 1], [1, 1], [1, 1], "NCHW", "float32"], {}, ["conv2d", [1, 128, 56, 56, "float32"], [256, 128, 3, 3, "float32"], [1, 1], [1, 1], [1, 1], "NCHW", "float32"], {"i": 714385, "t": "winograd", "c": null, "e": [["tile_b", "sp", [36, 1, 1, 1]], ["tile_y", "sp", [4, 2, 8, 4]], ["tile_x", "sp", [1, 7, 28, 1]], ["tile_rc", "sp", [16, 8]], ["auto_unroll_max_step", "ot", 1500], ["unroll_explicit", "ot", 1]]}], "r": [[0.00023493554432348364], 0, 4.635826826095581, 1535411899.2398431], "v": 0.1}
{"i": ["cuda -model=titanx", "topi_nn_conv2d", [["TENSOR", [1, 128, 112, 112], "float32"], ["TENSOR", [128, 128, 3, 3], "float32"], [1, 1], [1, 1], [1, 1], "NCHW", "float32"], {}, ["conv2d", [1, 128, 112, 112, "float32"], [128, 128, 3, 3, "float32"], [1, 1], [1, 1], [1, 1], "NCHW", "float32"], {"i": 1813376, "t": "winograd", "c": null, "e": [["tile_b", "sp", [36, 1, 1, 1]], ["tile_y", "sp", [2, 4, 8, 2]], ["tile_x", "sp", [7, 7, 16, 1]], ["tile_rc", "sp", [16, 8]], ["auto_unroll_max_step", "ot", 1500], ["unroll_explicit", "ot", 1]]}], "r": [[0.00042691407670454546], 0, 19.30599021911621, 1535414354.3659015], "v": 0.1}
{"i": ["cuda -model=titanx", "topi_nn_conv2d", [["TENSOR", [1, 64, 112, 112], "float32"], ["TENSOR", [128, 64, 3, 3], "float32"], [1, 1], [1, 1], [1, 1], "NCHW", "float32"], {}, ["conv2d", [1, 64, 112, 112, "float32"], [128, 64, 3, 3, "float32"], [1, 1], [1, 1], [1, 1], "NCHW", "float32"], {"i": 1603376, "t": "winograd", "c": null, "e": [["tile_b", "sp", [36, 1, 1, 1]], ["tile_y", "sp", [2, 4, 8, 2]], ["tile_x", "sp", [7, 7, 16, 1]], ["tile_rc", "sp", [8, 8]], ["auto_unroll_max_step", "ot", 1500], ["unroll_explicit", "ot", 1]]}], "r": [[0.0002890588754789272], 0, 3.4835450649261475, 1535415894.133812], "v": 0.1}
{"i": ["cuda -model=titanx", "topi_nn_conv2d", [["TENSOR", [1, 64, 224, 224], "float32"], ["TENSOR", [64, 64, 3, 3], "float32"], [1, 1], [1, 1], [1, 1], "NCHW", "float32"], {}, ["conv2d", [1, 64, 224, 224, "float32"], [64, 64, 3, 3, "float32"], [1, 1], [1, 1], [1, 1], "NCHW", "float32"], {"i": 2195318, "t": "winograd", "c": null, "e": [["tile_b", "sp", [36, 1, 1, 1]], ["tile_y", "sp", [1, 2, 8, 4]], ["tile_x", "sp", [49, 4, 16, 1]], ["tile_rc", "sp", [8, 8]], ["auto_unroll_max_step", "ot", 128], ["unroll_explicit", "ot", 1]]}], "r": [[0.0006257575269709544], 0, 5.687942981719971, 1535418141.8687968], "v": 0.1}
{"i": ["cuda -model=titanx", "topi_nn_conv2d", [["TENSOR", [1, 3, 224, 224], "float32"], ["TENSOR", [64, 3, 3, 3], "float32"], [1, 1], [1, 1], [1, 1], "NCHW", "float32"], {}, ["conv2d", [1, 3, 224, 224, "float32"], [64, 3, 3, 3, "float32"], [1, 1], [1, 1], [1, 1], "NCHW", "float32"], {"i": 59919263, "t": "direct", "c": null, "e": [["tile_f", "sp", [1, 2, 16, 2]], ["tile_y", "sp", [56, 1, 1, 4]], ["tile_x", "sp", [7, 2, 16, 1]], ["tile_rc", "sp", [3, 1]], ["tile_rx", "sp", [1, 3]], ["tile_ry", "sp", [1, 3]], ["auto_unroll_max_step", "ot", 512], ["unroll_explicit", "ot", 0]]}], "r": [[6.754253240324032e-05], 0, 1.5378711223602295, 1535422580.7674332], "v": 0.1}
{"i": ["cuda -model=titanx", "topi_nn_conv2d", [["TENSOR", [1, 2048, 7, 7], "float32"], ["TENSOR", [512, 2048, 1, 1], "float32"], [1, 1], [0, 0], [1, 1], "NCHW", "float32"], {}, ["conv2d", [1, 2048, 7, 7, "float32"], [512, 2048, 1, 1, "float32"], [1, 1], [0, 0], [1, 1], "NCHW", "float32"], {"i": 58555, "t": "direct", "c": null, "e": [["tile_f", "sp", [16, 2, 16, 1]], ["tile_y", "sp", [1, 1, 7, 1]], ["tile_x", "sp", [1, 1, 7, 1]], ["tile_rc", "sp", [128, 16]], ["tile_rx", "sp", [1, 1]], ["tile_ry", "sp", [1, 1]], ["auto_unroll_max_step", "ot", 512], ["unroll_explicit", "ot", 0]]}], "r": [[0.00015904646927966104], 0, 1.3764936923980713, 1535340979.3568566], "v": 0.1}
{"i": ["cuda -model=titanx", "topi_nn_conv2d", [["TENSOR", [1, 512, 7, 7], "float32"], ["TENSOR", [2048, 512, 1, 1], "float32"], [1, 1], [0, 0], [1, 1], "NCHW", "float32"], {}, ["conv2d", [1, 512, 7, 7, "float32"], [2048, 512, 1, 1, "float32"], [1, 1], [0, 0], [1, 1], "NCHW", "float32"], {"i": 143095, "t": "direct", "c": null, "e": [["tile_f", "sp", [64, 2, 16, 1]], ["tile_y", "sp", [1, 7, 1, 1]], ["tile_x", "sp", [1, 1, 7, 1]], ["tile_rc", "sp", [32, 16]], ["tile_rx", "sp", [1, 1]], ["tile_ry", "sp", [1, 1]], ["auto_unroll_max_step", "ot", 1500], ["unroll_explicit", "ot", 0]]}], "r": [[7.65306638061585e-05], 0, 2.2808291912078857, 1535342441.0873826], "v": 0.1}
{"i": ["cuda -model=titanx", "topi_nn_conv2d", [["TENSOR", [1, 1024, 14, 14], "float32"], ["TENSOR", [2048, 1024, 1, 1], "float32"], [2, 2], [0, 0], [1, 1], "NCHW", "float32"], {}, ["conv2d", [1, 1024, 14, 14, "float32"], [2048, 1024, 1, 1, "float32"], [2, 2], [0, 0], [1, 1], "NCHW", "float32"], {"i": 335004, "t": "direct", "c": null, "e": [["tile_f", "sp", [16, 2, 32, 2]], ["tile_y", "sp", [7, 1, 1, 1]], ["tile_x", "sp", [1, 1, 7, 1]], ["tile_rc", "sp", [256, 4]], ["tile_rx", "sp", [1, 1]], ["tile_ry", "sp", [1, 1]], ["auto_unroll_max_step", "ot", 1500], ["unroll_explicit", "ot", 1]]}], "r": [[0.00028060819402985073], 0, 1.6567697525024414, 1535343548.7764354], "v": 0.1}
{"i": ["cuda -model=titanx", "topi_nn_conv2d", [["TENSOR", [1, 1024, 14, 14], "float32"], ["TENSOR", [512, 1024, 1, 1], "float32"], [2, 2], [0, 0], [1, 1], "NCHW", "float32"], {}, ["conv2d", [1, 1024, 14, 14, "float32"], [512, 1024, 1, 1, "float32"], [2, 2], [0, 0], [1, 1], "NCHW", "float32"], {"i": 132040, "t": "direct", "c": null, "e": [["tile_f", "sp", [16, 1, 32, 1]], ["tile_y", "sp", [7, 1, 1, 1]], ["tile_x", "sp", [1, 1, 7, 1]], ["tile_rc", "sp", [64, 16]], ["tile_rx", "sp", [1, 1]], ["tile_ry", "sp", [1, 1]], ["auto_unroll_max_step", "ot", 0], ["unroll_explicit", "ot", 1]]}], "r": [[9.38442889305816e-05], 0, 1.886913776397705, 1535346388.4123077], "v": 0.1}
{"i": ["cuda -model=titanx", "topi_nn_conv2d", [["TENSOR", [1, 1024, 14, 14], "float32"], ["TENSOR", [256, 1024, 1, 1], "float32"], [1, 1], [0, 0], [1, 1], "NCHW", "float32"], {}, ["conv2d", [1, 1024, 14, 14, "float32"], [256, 1024, 1, 1, "float32"], [1, 1], [0, 0], [1, 1], "NCHW", "float32"], {"i": 2521885, "t": "direct", "c": null, "e": [["tile_f", "sp", [16, 2, 8, 1]], ["tile_y", "sp", [7, 1, 2, 1]], ["tile_x", "sp", [1, 1, 7, 2]], ["tile_rc", "sp", [64, 16]], ["tile_rx", "sp", [1, 1]], ["tile_ry", "sp", [1, 1]], ["auto_unroll_max_step", "ot", 1500], ["unroll_explicit", "ot", 1]]}], "r": [[7.780090051813472e-05], 0, 2.096433401107788, 1535347370.988212], "v": 0.1}
{"i": ["cuda -model=titanx", "topi_nn_conv2d", [["TENSOR", [1, 256, 14, 14], "float32"], ["TENSOR", [1024, 256, 1, 1], "float32"], [1, 1], [0, 0], [1, 1], "NCHW", "float32"], {}, ["conv2d", [1, 256, 14, 14, "float32"], [1024, 256, 1, 1, "float32"], [1, 1], [0, 0], [1, 1], "NCHW", "float32"], {"i": 2965852, "t": "direct", "c": null, "e": [["tile_f", "sp", [32, 4, 8, 1]], ["tile_y", "sp", [2, 7, 1, 1]], ["tile_x", "sp", [1, 1, 14, 1]], ["tile_rc", "sp", [16, 16]], ["tile_rx", "sp", [1, 1]], ["tile_ry", "sp", [1, 1]], ["auto_unroll_max_step", "ot", 512], ["unroll_explicit", "ot", 1]]}], "r": [[4.840749328644501e-05], 0, 34.52979779243469, 1535349067.3907256], "v": 0.1}
{"i": ["cuda -model=titanx", "topi_nn_conv2d", [["TENSOR", [1, 512, 28, 28], "float32"], ["TENSOR", [1024, 512, 1, 1], "float32"], [2, 2], [0, 0], [1, 1], "NCHW", "float32"], {}, ["conv2d", [1, 512, 28, 28, "float32"], [1024, 512, 1, 1, "float32"], [2, 2], [0, 0], [1, 1], "NCHW", "float32"], {"i": 1723190, "t": "direct", "c": null, "e": [["tile_f", "sp", [16, 4, 16, 1]], ["tile_y", "sp", [7, 1, 1, 2]], ["tile_x", "sp", [1, 1, 14, 1]], ["tile_rc", "sp", [64, 8]], ["tile_rx", "sp", [1, 1]], ["tile_ry", "sp", [1, 1]], ["auto_unroll_max_step", "ot", 1500], ["unroll_explicit", "ot", 0]]}], "r": [[0.00011870797707509881], 0, 6.502109050750732, 1535351117.3144069], "v": 0.1}
{"i": ["cuda -model=titanx", "topi_nn_conv2d", [["TENSOR", [1, 512, 28, 28], "float32"], ["TENSOR", [256, 512, 1, 1], "float32"], [2, 2], [0, 0], [1, 1], "NCHW", "float32"], {}, ["conv2d", [1, 512, 28, 28, "float32"], [256, 512, 1, 1, "float32"], [2, 2], [0, 0], [1, 1], "NCHW", "float32"], {"i": 1795299, "t": "direct", "c": null, "e": [["tile_f", "sp", [8, 1, 8, 4]], ["tile_y", "sp", [14, 1, 1, 1]], ["tile_x", "sp", [1, 1, 14, 1]], ["tile_rc", "sp", [128, 4]], ["tile_rx", "sp", [1, 1]], ["tile_ry", "sp", [1, 1]], ["auto_unroll_max_step", "ot", 512], ["unroll_explicit", "ot", 1]]}], "r": [[5.030473995983936e-05], 0, 14.208871603012085, 1535355244.8065631], "v": 0.1}
{"i": ["cuda -model=titanx", "topi_nn_conv2d", [["TENSOR", [1, 512, 28, 28], "float32"], ["TENSOR", [128, 512, 1, 1], "float32"], [1, 1], [0, 0], [1, 1], "NCHW", "float32"], {}, ["conv2d", [1, 512, 28, 28, "float32"], [128, 512, 1, 1, "float32"], [1, 1], [0, 0], [1, 1], "NCHW", "float32"], {"i": 6652823, "t": "direct", "c": null, "e": [["tile_f", "sp", [4, 4, 8, 1]], ["tile_y", "sp", [28, 1, 1, 1]], ["tile_x", "sp", [1, 1, 14, 2]], ["tile_rc", "sp", [32, 16]], ["tile_rx", "sp", [1, 1]], ["tile_ry", "sp", [1, 1]], ["auto_unroll_max_step", "ot", 0], ["unroll_explicit", "ot", 1]]}], "r": [[5.824087160589604e-05], 0, 8.829635620117188, 1535357359.3047445], "v": 0.1}
{"i": ["cuda -model=titanx", "topi_nn_conv2d", [["TENSOR", [1, 128, 28, 28], "float32"], ["TENSOR", [512, 128, 1, 1], "float32"], [1, 1], [0, 0], [1, 1], "NCHW", "float32"], {}, ["conv2d", [1, 128, 28, 28, "float32"], [512, 128, 1, 1, "float32"], [1, 1], [0, 0], [1, 1], "NCHW", "float32"], {"i": 4022069, "t": "direct", "c": null, "e": [["tile_f", "sp", [16, 4, 8, 1]], ["tile_y", "sp", [7, 4, 1, 1]], ["tile_x", "sp", [1, 1, 28, 1]], ["tile_rc", "sp", [16, 8]], ["tile_rx", "sp", [1, 1]], ["tile_ry", "sp", [1, 1]], ["auto_unroll_max_step", "ot", 512], ["unroll_explicit", "ot", 0]]}], "r": [[3.836637116564418e-05], 0, 30.88849425315857, 1535359778.4165032], "v": 0.1}
{"i": ["cuda -model=titanx", "topi_nn_conv2d", [["TENSOR", [1, 256, 56, 56], "float32"], ["TENSOR", [512, 256, 1, 1], "float32"], [2, 2], [0, 0], [1, 1], "NCHW", "float32"], {}, ["conv2d", [1, 256, 56, 56, "float32"], [512, 256, 1, 1, "float32"], [2, 2], [0, 0], [1, 1], "NCHW", "float32"], {"i": 13520886, "t": "direct", "c": null, "e": [["tile_f", "sp", [8, 1, 16, 4]], ["tile_y", "sp", [14, 1, 1, 2]], ["tile_x", "sp", [1, 2, 14, 1]], ["tile_rc", "sp", [64, 4]], ["tile_rx", "sp", [1, 1]], ["tile_ry", "sp", [1, 1]], ["auto_unroll_max_step", "ot", 512], ["unroll_explicit", "ot", 1]]}], "r": [[8.964673237753884e-05], 0, 21.609076023101807, 1535362579.700074], "v": 0.1}
{"i": ["cuda -model=titanx", "topi_nn_conv2d", [["TENSOR", [1, 256, 56, 56], "float32"], ["TENSOR", [128, 256, 1, 1], "float32"], [2, 2], [0, 0], [1, 1], "NCHW", "float32"], {}, ["conv2d", [1, 256, 56, 56, "float32"], [128, 256, 1, 1, "float32"], [2, 2], [0, 0], [1, 1], "NCHW", "float32"], {"i": 7564855, "t": "direct", "c": null, "e": [["tile_f", "sp", [4, 2, 8, 2]], ["tile_y", "sp", [28, 1, 1, 1]], ["tile_x", "sp", [1, 2, 14, 1]], ["tile_rc", "sp", [32, 8]], ["tile_rx", "sp", [1, 1]], ["tile_ry", "sp", [1, 1]], ["auto_unroll_max_step", "ot", 512], ["unroll_explicit", "ot", 1]]}], "r": [[3.5890965484408476e-05], 0, 7.409880638122559, 1535366580.0144885], "v": 0.1}
{"i": ["cuda -model=titanx", "topi_nn_conv2d", [["TENSOR", [1, 256, 56, 56], "float32"], ["TENSOR", [64, 256, 1, 1], "float32"], [1, 1], [0, 0], [1, 1], "NCHW", "float32"], {}, ["conv2d", [1, 256, 56, 56, "float32"], [64, 256, 1, 1, "float32"], [1, 1], [0, 0], [1, 1], "NCHW", "float32"], {"i": 6625940, "t": "direct", "c": null, "e": [["tile_f", "sp", [2, 4, 8, 1]], ["tile_y", "sp", [56, 1, 1, 1]], ["tile_x", "sp", [1, 4, 14, 1]], ["tile_rc", "sp", [32, 8]], ["tile_rx", "sp", [1, 1]], ["tile_ry", "sp", [1, 1]], ["auto_unroll_max_step", "ot", 512], ["unroll_explicit", "ot", 0]]}], "r": [[4.789036865624003e-05], 0, 1.2796452045440674, 1535367873.0130634], "v": 0.1}
{"i": ["cuda -model=titanx", "topi_nn_conv2d", [["TENSOR", [1, 64, 56, 56], "float32"], ["TENSOR", [256, 64, 1, 1], "float32"], [1, 1], [0, 0], [1, 1], "NCHW", "float32"], {}, ["conv2d", [1, 64, 56, 56, "float32"], [256, 64, 1, 1, "float32"], [1, 1], [0, 0], [1, 1], "NCHW", "float32"], {"i": 3542617, "t": "direct", "c": null, "e": [["tile_f", "sp", [8, 2, 8, 2]], ["tile_y", "sp", [28, 1, 1, 2]], ["tile_x", "sp", [1, 2, 28, 1]], ["tile_rc", "sp", [8, 8]], ["tile_rx", "sp", [1, 1]], ["tile_ry", "sp", [1, 1]], ["auto_unroll_max_step", "ot", 0], ["unroll_explicit", "ot", 0]]}], "r": [[4.3173960469779435e-05], 0, 19.429253578186035, 1535370537.716797], "v": 0.1}
{"i": ["cuda -model=titanx", "topi_nn_conv2d", [["TENSOR", [1, 1024, 7, 7], "float32"], ["TENSOR", [1024, 1024, 1, 1], "float32"], [1, 1], [0, 0], [1, 1], "NCHW", "float32"], {}, ["conv2d", [1, 1024, 7, 7, "float32"], [1024, 1024, 1, 1, "float32"], [1, 1], [0, 0], [1, 1], "NCHW", "float32"], {"i": 222539, "t": "direct", "c": null, "e": [["tile_f", "sp", [64, 2, 8, 1]], ["tile_y", "sp", [1, 1, 7, 1]], ["tile_x", "sp", [1, 1, 7, 1]], ["tile_rc", "sp", [64, 16]], ["tile_rx", "sp", [1, 1]], ["tile_ry", "sp", [1, 1]], ["auto_unroll_max_step", "ot", 512], ["unroll_explicit", "ot", 1]]}], "r": [[0.00012062812861736334], 0, 1.9216992855072021, 1535376563.6045246], "v": 0.1}
{"i": ["cuda -model=titanx", "topi_nn_conv2d", [["TENSOR", [1, 512, 7, 7], "float32"], ["TENSOR", [1024, 512, 1, 1], "float32"], [1, 1], [0, 0], [1, 1], "NCHW", "float32"], {}, ["conv2d", [1, 512, 7, 7, "float32"], [1024, 512, 1, 1, "float32"], [1, 1], [0, 0], [1, 1], "NCHW", "float32"], {"i": 108194, "t": "direct", "c": null, "e": [["tile_f", "sp", [64, 2, 4, 2]], ["tile_y", "sp", [1, 1, 7, 1]], ["tile_x", "sp", [1, 1, 7, 1]], ["tile_rc", "sp", [64, 8]], ["tile_rx", "sp", [1, 1]], ["tile_ry", "sp", [1, 1]], ["auto_unroll_max_step", "ot", 1500], ["unroll_explicit", "ot", 0]]}], "r": [[5.706907663125948e-05], 0, 1.3412449359893799, 1535379150.708214], "v": 0.1}
{"i": ["cuda -model=titanx", "topi_nn_conv2d", [["TENSOR", [1, 512, 14, 14], "float32"], ["TENSOR", [512, 512, 1, 1], "float32"], [1, 1], [0, 0], [1, 1], "NCHW", "float32"], {}, ["conv2d", [1, 512, 14, 14, "float32"], [512, 512, 1, 1, "float32"], [1, 1], [0, 0], [1, 1], "NCHW", "float32"], {"i": 771840, "t": "direct", "c": null, "e": [["tile_f", "sp", [16, 2, 8, 2]], ["tile_y", "sp", [7, 1, 2, 1]], ["tile_x", "sp", [1, 1, 7, 2]], ["tile_rc", "sp", [64, 8]], ["tile_rx", "sp", [1, 1]], ["tile_ry", "sp", [1, 1]], ["auto_unroll_max_step", "ot", 512], ["unroll_explicit", "ot", 0]]}], "r": [[6.098708732737612e-05], 0, 2.6358609199523926, 1535381939.087032], "v": 0.1}
{"i": ["cuda -model=titanx", "topi_nn_conv2d", [["TENSOR", [1, 256, 14, 14], "float32"], ["TENSOR", [512, 256, 1, 1], "float32"], [1, 1], [0, 0], [1, 1], "NCHW", "float32"], {}, ["conv2d", [1, 256, 14, 14, "float32"], [512, 256, 1, 1, "float32"], [1, 1], [0, 0], [1, 1], "NCHW", "float32"], {"i": 715461, "t": "direct", "c": null, "e": [["tile_f", "sp", [32, 4, 4, 1]], ["tile_y", "sp", [7, 1, 2, 1]], ["tile_x", "sp", [1, 1, 7, 2]], ["tile_rc", "sp", [32, 8]], ["tile_rx", "sp", [1, 1]], ["tile_ry", "sp", [1, 1]], ["auto_unroll_max_step", "ot", 512], ["unroll_explicit", "ot", 0]]}], "r": [[3.3200288139329807e-05], 0, 5.702603101730347, 1535384171.1888306], "v": 0.1}
{"i": ["cuda -model=titanx", "topi_nn_conv2d", [["TENSOR", [1, 256, 28, 28], "float32"], ["TENSOR", [256, 256, 1, 1], "float32"], [1, 1], [0, 0], [1, 1], "NCHW", "float32"], {}, ["conv2d", [1, 256, 28, 28, "float32"], [256, 256, 1, 1, "float32"], [1, 1], [0, 0], [1, 1], "NCHW", "float32"], {"i": 3339832, "t": "direct", "c": null, "e": [["tile_f", "sp", [8, 2, 8, 2]], ["tile_y", "sp", [14, 2, 1, 1]], ["tile_x", "sp", [1, 1, 14, 2]], ["tile_rc", "sp", [32, 8]], ["tile_rx", "sp", [1, 1]], ["tile_ry", "sp", [1, 1]], ["auto_unroll_max_step", "ot", 512], ["unroll_explicit", "ot", 0]]}], "r": [[4.51544672033393e-05], 0, 1.2489631175994873, 1535386621.2483017], "v": 0.1}
{"i": ["cuda -model=titanx", "topi_nn_conv2d", [["TENSOR", [1, 128, 28, 28], "float32"], ["TENSOR", [256, 128, 1, 1], "float32"], [1, 1], [0, 0], [1, 1], "NCHW", "float32"], {}, ["conv2d", [1, 128, 28, 28, "float32"], [256, 128, 1, 1, "float32"], [1, 1], [0, 0], [1, 1], "NCHW", "float32"], {"i": 5190596, "t": "direct", "c": null, "e": [["tile_f", "sp", [8, 4, 8, 1]], ["tile_y", "sp", [14, 1, 1, 2]], ["tile_x", "sp", [1, 1, 14, 2]], ["tile_rc", "sp", [16, 8]], ["tile_rx", "sp", [1, 1]], ["tile_ry", "sp", [1, 1]], ["auto_unroll_max_step", "ot", 1500], ["unroll_explicit", "ot", 0]]}], "r": [[2.6632782280701753e-05], 0, 3.803677797317505, 1535390486.2065094], "v": 0.1}
{"i": ["cuda -model=titanx", "topi_nn_conv2d", [["TENSOR", [1, 64, 56, 56], "float32"], ["TENSOR", [128, 64, 1, 1], "float32"], [1, 1], [0, 0], [1, 1], "NCHW", "float32"], {}, ["conv2d", [1, 64, 56, 56, "float32"], [128, 64, 1, 1, "float32"], [1, 1], [0, 0], [1, 1], "NCHW", "float32"], {"i": 7948975, "t": "direct", "c": null, "e": [["tile_f", "sp", [4, 2, 8, 2]], ["tile_y", "sp", [28, 2, 1, 1]], ["tile_x", "sp", [1, 2, 28, 1]], ["tile_rc", "sp", [8, 8]], ["tile_rx", "sp", [1, 1]], ["tile_ry", "sp", [1, 1]], ["auto_unroll_max_step", "ot", 512], ["unroll_explicit", "ot", 0]]}], "r": [[2.3504540112817302e-05], 0, 1.3222031593322754, 1535397725.9387324], "v": 0.1}
{"i": ["cuda -model=titanx", "topi_nn_conv2d", [["TENSOR", [1, 32, 112, 112], "float32"], ["TENSOR", [64, 32, 1, 1], "float32"], [1, 1], [0, 0], [1, 1], "NCHW", "float32"], {}, ["conv2d", [1, 32, 112, 112, "float32"], [64, 32, 1, 1, "float32"], [1, 1], [0, 0], [1, 1], "NCHW", "float32"], {"i": 23485665, "t": "direct", "c": null, "e": [["tile_f", "sp", [1, 8, 8, 1]], ["tile_y", "sp", [28, 2, 2, 1]], ["tile_x", "sp", [7, 1, 16, 1]], ["tile_rc", "sp", [8, 4]], ["tile_rx", "sp", [1, 1]], ["tile_ry", "sp", [1, 1]], ["auto_unroll_max_step", "ot", 1500], ["unroll_explicit", "ot", 0]]}], "r": [[2.6321584531743247e-05], 0, 1.2850267887115479, 1535400525.906705], "v": 0.1}
{"i": ["cuda -model=titanx", "topi_nn_conv2d", [["TENSOR", [1, 3, 224, 224], "float32"], ["TENSOR", [32, 3, 3, 3], "float32"], [2, 2], [1, 1], [1, 1], "NCHW", "float32"], {}, ["conv2d", [1, 3, 224, 224, "float32"], [32, 3, 3, 3, "float32"], [2, 2], [1, 1], [1, 1], "NCHW", "float32"], {"i": 41999093, "t": "direct", "c": null, "e": [["tile_f", "sp", [1, 1, 8, 4]], ["tile_y", "sp", [16, 7, 1, 1]], ["tile_x", "sp", [7, 1, 16, 1]], ["tile_rc", "sp", [3, 1]], ["tile_rx", "sp", [1, 3]], ["tile_ry", "sp", [1, 3]], ["auto_unroll_max_step", "ot", 512], ["unroll_explicit", "ot", 1]]}], "r": [[1.3977960968793665e-05], 0, 1.3667681217193604, 1535403596.0402923], "v": 0.1}
{"i": ["cuda -model=titanx", "topi_nn_conv2d", [["TENSOR", [1, 512, 7, 7], "float32"], ["TENSOR", [512, 512, 3, 3], "float32"], [1, 1], [1, 1], [1, 1], "NCHW", "float32"], {}, ["conv2d", [1, 512, 7, 7, "float32"], [512, 512, 3, 3, "float32"], [1, 1], [1, 1], [1, 1], "NCHW", "float32"], {"i": 344206, "t": "winograd", "c": null, "e": [["tile_b", "sp", [16, 1, 1, 1]], ["tile_y", "sp", [8, 1, 16, 4]], ["tile_x", "sp", [1, 1, 8, 2]], ["tile_rc", "sp", [32, 16]], ["auto_unroll_max_step", "ot", 128], ["unroll_explicit", "ot", 1]]}], "r": [[8.610198970251716e-05], 0, 1.4480016231536865, 1535511176.105762], "v": 0.1}
{"i": ["cuda -model=titanx", "topi_nn_conv2d", [["TENSOR", [1, 256, 14, 14], "float32"], ["TENSOR", [512, 256, 1, 1], "float32"], [2, 2], [0, 0], [1, 1], "NCHW", "float32"], {}, ["conv2d", [1, 256, 14, 14, "float32"], [512, 256, 1, 1, "float32"], [2, 2], [0, 0], [1, 1], "NCHW", "float32"], {"i": 110915, "t": "direct", "c": null, "e": [["tile_f", "sp", [16, 2, 16, 1]], ["tile_y", "sp", [7, 1, 1, 1]], ["tile_x", "sp", [1, 1, 7, 1]], ["tile_rc", "sp", [16, 16]], ["tile_rx", "sp", [1, 1]], ["tile_ry", "sp", [1, 1]], ["auto_unroll_max_step", "ot", 0], ["unroll_explicit", "ot", 1]]}], "r": [[2.729347361717613e-05], 0, 1.236013412475586, 1535512971.3886647], "v": 0.1}
{"i": ["cuda -model=titanx", "topi_nn_conv2d", [["TENSOR", [1, 256, 14, 14], "float32"], ["TENSOR", [512, 256, 3, 3], "float32"], [2, 2], [1, 1], [1, 1], "NCHW", "float32"], {}, ["conv2d", [1, 256, 14, 14, "float32"], [512, 256, 3, 3, "float32"], [2, 2], [1, 1], [1, 1], "NCHW", "float32"], {"i": 736155, "t": "direct", "c": null, "e": [["tile_f", "sp", [16, 2, 16, 1]], ["tile_y", "sp", [1, 1, 7, 1]], ["tile_x", "sp", [7, 1, 1, 1]], ["tile_rc", "sp", [64, 4]], ["tile_rx", "sp", [1, 3]], ["tile_ry", "sp", [1, 3]], ["auto_unroll_max_step", "ot", 1500], ["unroll_explicit", "ot", 1]]}], "r": [[0.00016977524406779662], 0, 2.0983633995056152, 1535514397.926689], "v": 0.1}
{"i": ["cuda -model=titanx", "topi_nn_conv2d", [["TENSOR", [1, 256, 14, 14], "float32"], ["TENSOR", [256, 256, 3, 3], "float32"], [1, 1], [1, 1], [1, 1], "NCHW", "float32"], {}, ["conv2d", [1, 256, 14, 14, "float32"], [256, 256, 3, 3, "float32"], [1, 1], [1, 1], [1, 1], "NCHW", "float32"], {"i": 66732, "t": "winograd", "c": null, "e": [["tile_b", "sp", [16, 1, 1, 1]], ["tile_y", "sp", [4, 2, 16, 2]], ["tile_x", "sp", [1, 7, 7, 1]], ["tile_rc", "sp", [16, 16]], ["auto_unroll_max_step", "ot", 128], ["unroll_explicit", "ot", 1]]}], "r": [[7.205142459173871e-05], 0, 1.4618885517120361, 1535515568.3814023], "v": 0.1}
{"i": ["cuda -model=titanx", "topi_nn_conv2d", [["TENSOR", [1, 128, 28, 28], "float32"], ["TENSOR", [256, 128, 1, 1], "float32"], [2, 2], [0, 0], [1, 1], "NCHW", "float32"], {}, ["conv2d", [1, 128, 28, 28, "float32"], [256, 128, 1, 1, "float32"], [2, 2], [0, 0], [1, 1], "NCHW", "float32"], {"i": 528026, "t": "direct", "c": null, "e": [["tile_f", "sp", [8, 4, 8, 1]], ["tile_y", "sp", [14, 1, 1, 1]], ["tile_x", "sp", [1, 1, 14, 1]], ["tile_rc", "sp", [8, 16]], ["tile_rx", "sp", [1, 1]], ["tile_ry", "sp", [1, 1]], ["auto_unroll_max_step", "ot", 512], ["unroll_explicit", "ot", 0]]}], "r": [[1.621085209760274e-05], 0, 10.320522785186768, 1535516689.8571618], "v": 0.1}
{"i": ["cuda -model=titanx", "topi_nn_conv2d", [["TENSOR", [1, 128, 28, 28], "float32"], ["TENSOR", [256, 128, 3, 3], "float32"], [2, 2], [1, 1], [1, 1], "NCHW", "float32"], {}, ["conv2d", [1, 128, 28, 28, "float32"], [256, 128, 3, 3, "float32"], [2, 2], [1, 1], [1, 1], "NCHW", "float32"], {"i": 5183051, "t": "direct", "c": null, "e": [["tile_f", "sp", [8, 1, 16, 2]], ["tile_y", "sp", [7, 1, 2, 1]], ["tile_x", "sp", [1, 1, 7, 2]], ["tile_rc", "sp", [32, 4]], ["tile_rx", "sp", [1, 3]], ["tile_ry", "sp", [1, 3]], ["auto_unroll_max_step", "ot", 0], ["unroll_explicit", "ot", 1]]}], "r": [[9.29051653250774e-05], 0, 1.2669603824615479, 1535518191.0489676], "v": 0.1}
{"i": ["cuda -model=titanx", "topi_nn_conv2d", [["TENSOR", [1, 128, 28, 28], "float32"], ["TENSOR", [128, 128, 3, 3], "float32"], [1, 1], [1, 1], [1, 1], "NCHW", "float32"], {}, ["conv2d", [1, 128, 28, 28, "float32"], [128, 128, 3, 3, "float32"], [1, 1], [1, 1], [1, 1], "NCHW", "float32"], {"i": 520156, "t": "winograd", "c": null, "e": [["tile_b", "sp", [16, 1, 1, 1]], ["tile_y", "sp", [4, 2, 4, 4]], ["tile_x", "sp", [1, 2, 98, 1]], ["tile_rc", "sp", [16, 8]], ["auto_unroll_max_step", "ot", 1500], ["unroll_explicit", "ot", 1]]}], "r": [[6.1538798195242e-05], 0, 2.2867848873138428, 1535519772.1041968], "v": 0.1}
{"i": ["cuda -model=titanx", "topi_nn_conv2d", [["TENSOR", [1, 64, 56, 56], "float32"], ["TENSOR", [128, 64, 1, 1], "float32"], [2, 2], [0, 0], [1, 1], "NCHW", "float32"], {}, ["conv2d", [1, 64, 56, 56, "float32"], [128, 64, 1, 1, "float32"], [2, 2], [0, 0], [1, 1], "NCHW", "float32"], {"i": 1996855, "t": "direct", "c": null, "e": [["tile_f", "sp", [4, 2, 8, 2]], ["tile_y", "sp", [28, 1, 1, 1]], ["tile_x", "sp", [1, 2, 14, 1]], ["tile_rc", "sp", [8, 8]], ["tile_rx", "sp", [1, 1]], ["tile_ry", "sp", [1, 1]], ["auto_unroll_max_step", "ot", 512], ["unroll_explicit", "ot", 0]]}], "r": [[1.2646983313669309e-05], 0, 1.2524137496948242, 1535521080.8447835], "v": 0.1}
{"i": ["cuda -model=titanx", "topi_nn_conv2d", [["TENSOR", [1, 64, 56, 56], "float32"], ["TENSOR", [128, 64, 3, 3], "float32"], [2, 2], [1, 1], [1, 1], "NCHW", "float32"], {}, ["conv2d", [1, 64, 56, 56, "float32"], [128, 64, 3, 3, "float32"], [2, 2], [1, 1], [1, 1], "NCHW", "float32"], {"i": 31178187, "t": "direct", "c": null, "e": [["tile_f", "sp", [4, 2, 16, 1]], ["tile_y", "sp", [14, 1, 1, 2]], ["tile_x", "sp", [2, 1, 14, 1]], ["tile_rc", "sp", [32, 2]], ["tile_rx", "sp", [1, 3]], ["tile_ry", "sp", [1, 3]], ["auto_unroll_max_step", "ot", 1500], ["unroll_explicit", "ot", 1]]}], "r": [[6.736485554060117e-05], 0, 1.3498356342315674, 1535522336.8640018], "v": 0.1}
{"i": ["cuda -model=titanx", "topi_nn_conv2d", [["TENSOR", [1, 64, 56, 56], "float32"], ["TENSOR", [64, 64, 1, 1], "float32"], [1, 1], [0, 0], [1, 1], "NCHW", "float32"], {}, ["conv2d", [1, 64, 56, 56, "float32"], [64, 64, 1, 1, "float32"], [1, 1], [0, 0], [1, 1], "NCHW", "float32"], {"i": 13628176, "t": "direct", "c": null, "e": [["tile_f", "sp", [2, 8, 4, 1]], ["tile_y", "sp", [56, 1, 1, 1]], ["tile_x", "sp", [1, 2, 28, 1]], ["tile_rc", "sp", [4, 16]], ["tile_rx", "sp", [1, 1]], ["tile_ry", "sp", [1, 1]], ["auto_unroll_max_step", "ot", 0], ["unroll_explicit", "ot", 1]]}], "r": [[1.5144373877056628e-05], 0, 4.291016101837158, 1535524033.4773188], "v": 0.1}
{"i": ["cuda -model=titanx", "topi_nn_conv2d", [["TENSOR", [1, 64, 56, 56], "float32"], ["TENSOR", [64, 64, 3, 3], "float32"], [1, 1], [1, 1], [1, 1], "NCHW", "float32"], {}, ["conv2d", [1, 64, 56, 56, "float32"], [64, 64, 3, 3, "float32"], [1, 1], [1, 1], [1, 1], "NCHW", "float32"], {"i": 263327, "t": "winograd", "c": null, "e": [["tile_b", "sp", [36, 1, 1, 1]], ["tile_y", "sp", [2, 1, 4, 8]], ["tile_x", "sp", [1, 2, 98, 1]], ["tile_rc", "sp", [8, 8]], ["auto_unroll_max_step", "ot", 128], ["unroll_explicit", "ot", 1]]}], "r": [[6.067211160533765e-05], 0, 2.9739716053009033, 1535525609.763939], "v": 0.1}
{"i": ["cuda -model=titanx", "topi_nn_conv2d", [["TENSOR", [1, 992, 7, 7], "float32"], ["TENSOR", [128, 992, 1, 1], "float32"], [1, 1], [0, 0], [1, 1], "NCHW", "float32"], {}, ["conv2d", [1, 992, 7, 7, "float32"], [128, 992, 1, 1, "float32"], [1, 1], [0, 0], [1, 1], "NCHW", "float32"], {"i": 100826, "t": "direct", "c": null, "e": [["tile_f", "sp", [8, 1, 16, 1]], ["tile_y", "sp", [7, 1, 1, 1]], ["tile_x", "sp", [1, 1, 7, 1]], ["tile_rc", "sp", [62, 16]], ["tile_rx", "sp", [1, 1]], ["tile_ry", "sp", [1, 1]], ["auto_unroll_max_step", "ot", 512], ["unroll_explicit", "ot", 1]]}], "r": [[3.591533125897558e-05], 0, 1.1918675899505615, 1535541649.1359475], "v": 0.1}
{"i": ["cuda -model=titanx", "topi_nn_conv2d", [["TENSOR", [1, 960, 7, 7], "float32"], ["TENSOR", [128, 960, 1, 1], "float32"], [1, 1], [0, 0], [1, 1], "NCHW", "float32"], {}, ["conv2d", [1, 960, 7, 7, "float32"], [128, 960, 1, 1, "float32"], [1, 1], [0, 0], [1, 1], "NCHW", "float32"], {"i": 73946, "t": "direct", "c": null, "e": [["tile_f", "sp", [8, 1, 16, 1]], ["tile_y", "sp", [7, 1, 1, 1]], ["tile_x", "sp", [1, 1, 7, 1]], ["tile_rc", "sp", [60, 16]], ["tile_rx", "sp", [1, 1]], ["tile_ry", "sp", [1, 1]], ["auto_unroll_max_step", "ot", 512], ["unroll_explicit", "ot", 0]]}], "r": [[3.460836556169429e-05], 0, 18.39060950279236, 1535542453.8870785], "v": 0.1}
{"i": ["cuda -model=titanx", "topi_nn_conv2d", [["TENSOR", [1, 928, 7, 7], "float32"], ["TENSOR", [128, 928, 1, 1], "float32"], [1, 1], [0, 0], [1, 1], "NCHW", "float32"], {}, ["conv2d", [1, 928, 7, 7, "float32"], [128, 928, 1, 1, "float32"], [1, 1], [0, 0], [1, 1], "NCHW", "float32"], {"i": 77786, "t": "direct", "c": null, "e": [["tile_f", "sp", [8, 1, 16, 1]], ["tile_y", "sp", [7, 1, 1, 1]], ["tile_x", "sp", [1, 1, 7, 1]], ["tile_rc", "sp", [58, 16]], ["tile_rx", "sp", [1, 1]], ["tile_ry", "sp", [1, 1]], ["auto_unroll_max_step", "ot", 0], ["unroll_explicit", "ot", 1]]}], "r": [[3.402473731477324e-05], 0, 1.248830795288086, 1535543187.1269765], "v": 0.1}
{"i": ["cuda -model=titanx", "topi_nn_conv2d", [["TENSOR", [1, 896, 7, 7], "float32"], ["TENSOR", [128, 896, 1, 1], "float32"], [1, 1], [0, 0], [1, 1], "NCHW", "float32"], {}, ["conv2d", [1, 896, 7, 7, "float32"], [128, 896, 1, 1, "float32"], [1, 1], [0, 0], [1, 1], "NCHW", "float32"], {"i": 102746, "t": "direct", "c": null, "e": [["tile_f", "sp", [8, 1, 16, 1]], ["tile_y", "sp", [7, 1, 1, 1]], ["tile_x", "sp", [1, 1, 7, 1]], ["tile_rc", "sp", [64, 14]], ["tile_rx", "sp", [1, 1]], ["tile_ry", "sp", [1, 1]], ["auto_unroll_max_step", "ot", 0], ["unroll_explicit", "ot", 1]]}], "r": [[2.9833012105576504e-05], 0, 1.2429931163787842, 1535543904.137366], "v": 0.1}
{"i": ["cuda -model=titanx", "topi_nn_conv2d", [["TENSOR", [1, 864, 7, 7], "float32"], ["TENSOR", [128, 864, 1, 1], "float32"], [1, 1], [0, 0], [1, 1], "NCHW", "float32"], {}, ["conv2d", [1, 864, 7, 7, "float32"], [128, 864, 1, 1, "float32"], [1, 1], [0, 0], [1, 1], "NCHW", "float32"], {"i": 200666, "t": "direct", "c": null, "e": [["tile_f", "sp", [8, 1, 16, 1]], ["tile_y", "sp", [7, 1, 1, 1]], ["tile_x", "sp", [1, 1, 7, 1]], ["tile_rc", "sp", [54, 16]], ["tile_rx", "sp", [1, 1]], ["tile_ry", "sp", [1, 1]], ["auto_unroll_max_step", "ot", 512], ["unroll_explicit", "ot", 1]]}], "r": [[3.1719856631578944e-05], 0, 10.93128776550293, 1535544717.37846], "v": 0.1}
{"i": ["cuda -model=titanx", "topi_nn_conv2d", [["TENSOR", [1, 832, 7, 7], "float32"], ["TENSOR", [128, 832, 1, 1], "float32"], [1, 1], [0, 0], [1, 1], "NCHW", "float32"], {}, ["conv2d", [1, 832, 7, 7, "float32"], [128, 832, 1, 1, "float32"], [1, 1], [0, 0], [1, 1], "NCHW", "float32"], {"i": 10586, "t": "direct", "c": null, "e": [["tile_f", "sp", [8, 1, 16, 1]], ["tile_y", "sp", [7, 1, 1, 1]], ["tile_x", "sp", [1, 1, 7, 1]], ["tile_rc", "sp", [52, 16]], ["tile_rx", "sp", [1, 1]], ["tile_ry", "sp", [1, 1]], ["auto_unroll_max_step", "ot", 0], ["unroll_explicit", "ot", 0]]}], "r": [[3.109051445683602e-05], 0, 1.3161144256591797, 1535545449.2476206], "v": 0.1}
{"i": ["cuda -model=titanx", "topi_nn_conv2d", [["TENSOR", [1, 800, 7, 7], "float32"], ["TENSOR", [128, 800, 1, 1], "float32"], [1, 1], [0, 0], [1, 1], "NCHW", "float32"], {}, ["conv2d", [1, 800, 7, 7, "float32"], [128, 800, 1, 1, "float32"], [1, 1], [0, 0], [1, 1], "NCHW", "float32"], {"i": 16346, "t": "direct", "c": null, "e": [["tile_f", "sp", [8, 1, 16, 1]], ["tile_y", "sp", [7, 1, 1, 1]], ["tile_x", "sp", [1, 1, 7, 1]], ["tile_rc", "sp", [32, 25]], ["tile_rx", "sp", [1, 1]], ["tile_ry", "sp", [1, 1]], ["auto_unroll_max_step", "ot", 0], ["unroll_explicit", "ot", 0]]}], "r": [[3.168217405126168e-05], 0, 2.2161407470703125, 1535546141.5243394], "v": 0.1}
{"i": ["cuda -model=titanx", "topi_nn_conv2d", [["TENSOR", [1, 768, 7, 7], "float32"], ["TENSOR", [128, 768, 1, 1], "float32"], [1, 1], [0, 0], [1, 1], "NCHW", "float32"], {}, ["conv2d", [1, 768, 7, 7, "float32"], [128, 768, 1, 1, "float32"], [1, 1], [0, 0], [1, 1], "NCHW", "float32"], {"i": 14426, "t": "direct", "c": null, "e": [["tile_f", "sp", [8, 1, 16, 1]], ["tile_y", "sp", [7, 1, 1, 1]], ["tile_x", "sp", [1, 1, 7, 1]], ["tile_rc", "sp", [48, 16]], ["tile_rx", "sp", [1, 1]], ["tile_ry", "sp", [1, 1]], ["auto_unroll_max_step", "ot", 0], ["unroll_explicit", "ot", 0]]}], "r": [[2.887415226179018e-05], 0, 1.545259714126587, 1535546886.594689], "v": 0.1}
{"i": ["cuda -model=titanx", "topi_nn_conv2d", [["TENSOR", [1, 736, 7, 7], "float32"], ["TENSOR", [128, 736, 1, 1], "float32"], [1, 1], [0, 0], [1, 1], "NCHW", "float32"], {}, ["conv2d", [1, 736, 7, 7, "float32"], [128, 736, 1, 1, "float32"], [1, 1], [0, 0], [1, 1], "NCHW", "float32"], {"i": 10581, "t": "direct", "c": null, "e": [["tile_f", "sp", [16, 1, 8, 1]], ["tile_y", "sp", [7, 1, 1, 1]], ["tile_x", "sp", [1, 1, 7, 1]], ["tile_rc", "sp", [32, 23]], ["tile_rx", "sp", [1, 1]], ["tile_ry", "sp", [1, 1]], ["auto_unroll_max_step", "ot", 0], ["unroll_explicit", "ot", 0]]}], "r": [[2.998375162548765e-05], 0, 3.117043972015381, 1535547588.8117917], "v": 0.1}
{"i": ["cuda -model=titanx", "topi_nn_conv2d", [["TENSOR", [1, 704, 7, 7], "float32"], ["TENSOR", [128, 704, 1, 1], "float32"], [1, 1], [0, 0], [1, 1], "NCHW", "float32"], {}, ["conv2d", [1, 704, 7, 7, "float32"], [128, 704, 1, 1, "float32"], [1, 1], [0, 0], [1, 1], "NCHW", "float32"], {"i": 64581, "t": "direct", "c": null, "e": [["tile_f", "sp", [16, 1, 8, 1]], ["tile_y", "sp", [1, 1, 7, 1]], ["tile_x", "sp", [1, 1, 7, 1]], ["tile_rc", "sp", [44, 16]], ["tile_rx", "sp", [1, 1]], ["tile_ry", "sp", [1, 1]], ["auto_unroll_max_step", "ot", 1500], ["unroll_explicit", "ot", 0]]}], "r": [[2.866922851002865e-05], 0, 4.251639366149902, 1535548336.165861], "v": 0.1}
