tophub/mali_v0.01.log
{"i": ["opencl -model=rk3399 -device=mali", "topi_nn_conv2d", [["TENSOR", [1, 3, 224, 224], "float32"], ["TENSOR", [64, 3, 3, 3], "float32"], [2, 2], [1, 1], "NCHW", "float32"], {}, ["conv2d", [1, 3, 224, 224, "float32"], [64, 3, 3, 3, "float32"], [2, 2], [1, 1], "NCHW", "float32"], {"i": 2465835, "c": null, "t": "direct", "e": [["tile_co", "sp", [4, 4, 4]], ["tile_oh", "sp", [112, 1, 1]], ["tile_ow", "sp", [2, 14, 4]], ["reorder_0", "re", [0, 1, 2, 3, 4, 5, 6, 9, 7, 8]], ["ann_reduce", "an", ["none", "unroll"]], ["ann_spatial", "an", ["none", "unroll", "vec"]]]}], "v": 0.1, "r": [[0.003503452], 0, 0.631648063659668, 1534784665.5832863]}
{"i": ["opencl -model=rk3399 -device=mali", "topi_nn_conv2d", [["TENSOR", [1, 64, 55, 55], "float32"], ["TENSOR", [16, 64, 1, 1], "float32"], [1, 1], [0, 0], "NCHW", "float32"], {}, ["conv2d", [1, 64, 55, 55, "float32"], [16, 64, 1, 1, "float32"], [1, 1], [0, 0], "NCHW", "float32"], {"i": 130556, "c": null, "t": "direct", "e": [["tile_co", "sp", [1, 4, 4]], ["tile_oh", "sp", [55, 1, 1]], ["tile_ow", "sp", [11, 1, 5]], ["reorder_0", "re", [0, 1, 2, 3, 4, 5, 6, 9, 7, 8]], ["ann_reduce", "an", ["none", "unroll"]], ["ann_spatial", "an", ["unroll", "unroll", "vec"]]]}], "v": 0.1, "r": [[0.000894939625], 0, 0.43424487113952637, 1534785262.3156724]}
{"i": ["opencl -model=rk3399 -device=mali", "topi_nn_conv2d", [["TENSOR", [1, 16, 55, 55], "float32"], ["TENSOR", [64, 16, 1, 1], "float32"], [1, 1], [0, 0], "NCHW", "float32"], {}, ["conv2d", [1, 16, 55, 55, "float32"], [64, 16, 1, 1, "float32"], [1, 1], [0, 0], "NCHW", "float32"], {"i": 107619, "c": null, "t": "direct", "e": [["tile_co", "sp", [4, 4, 4]], ["tile_oh", "sp", [55, 1, 1]], ["tile_ow", "sp", [11, 1, 5]], ["reorder_0", "re", [0, 1, 2, 3, 4, 5, 6, 9, 7, 8]], ["ann_reduce", "an", ["unroll", "unroll"]], ["ann_spatial", "an", ["none", "unroll", "vec"]]]}], "v": 0.1, "r": [[0.0008865205], 0, 0.48459386825561523, 1534785643.458716]}
{"i": ["opencl -model=rk3399 -device=mali", "topi_nn_conv2d", [["TENSOR", [1, 16, 55, 55], "float32"], ["TENSOR", [64, 16, 3, 3], "float32"], [1, 1], [1, 1], "NCHW", "float32"], {}, ["conv2d", [1, 16, 55, 55, "float32"], [64, 16, 3, 3, "float32"], [1, 1], [1, 1], "NCHW", "float32"], {"i": 252771, "c": null, "t": "direct", "e": [["tile_co", "sp", [4, 4, 4]], ["tile_oh", "sp", [55, 1, 1]], ["tile_ow", "sp", [11, 1, 5]], ["reorder_0", "re", [0, 1, 2, 3, 4, 5, 6, 9, 7, 8]], ["ann_reduce", "an", ["unroll", "unroll"]], ["ann_spatial", "an", ["unroll", "unroll", "vec"]]]}], "v": 0.1, "r": [[0.00299680025], 0, 0.9511630535125732, 1534785996.6508455]}
{"i": ["opencl -model=rk3399 -device=mali", "topi_nn_conv2d", [["TENSOR", [1, 128, 55, 55], "float32"], ["TENSOR", [16, 128, 1, 1], "float32"], [1, 1], [0, 0], "NCHW", "float32"], {}, ["conv2d", [1, 128, 55, 55, "float32"], [16, 128, 1, 1, "float32"], [1, 1], [0, 0], "NCHW", "float32"], {"i": 135416, "c": null, "t": "direct", "e": [["tile_co", "sp", [1, 4, 4]], ["tile_oh", "sp", [55, 1, 1]], ["tile_ow", "sp", [11, 1, 5]], ["reorder_0", "re", [0, 1, 2, 3, 4, 5, 6, 9, 7, 8]], ["ann_reduce", "an", ["unroll", "unroll"]], ["ann_spatial", "an", ["unroll", "unroll", "vec"]]]}], "v": 0.1, "r": [[0.001490051], 0, 0.4474771022796631, 1534786546.7636065]}
{"i": ["opencl -model=rk3399 -device=mali", "topi_nn_conv2d", [["TENSOR", [1, 128, 27, 27], "float32"], ["TENSOR", [32, 128, 1, 1], "float32"], [1, 1], [0, 0], "NCHW", "float32"], {}, ["conv2d", [1, 128, 27, 27, "float32"], [32, 128, 1, 1, "float32"], [1, 1], [0, 0], "NCHW", "float32"], {"i": 99553, "c": null, "t": "direct", "e": [["tile_co", "sp", [2, 4, 4]], ["tile_oh", "sp", [27, 1, 1]], ["tile_ow", "sp", [9, 1, 3]], ["reorder_0", "re", [0, 1, 2, 3, 4, 5, 6, 9, 7, 8]], ["ann_reduce", "an", ["unroll", "unroll"]], ["ann_spatial", "an", ["none", "unroll", "vec"]]]}], "v": 0.1, "r": [[0.000670541125], 0, 0.45807671546936035, 1534786969.579846]}
{"i": ["opencl -model=rk3399 -device=mali", "topi_nn_conv2d", [["TENSOR", [1, 32, 27, 27], "float32"], ["TENSOR", [128, 32, 1, 1], "float32"], [1, 1], [0, 0], "NCHW", "float32"], {}, ["conv2d", [1, 32, 27, 27, "float32"], [128, 32, 1, 1, "float32"], [1, 1], [0, 0], "NCHW", "float32"], {"i": 156257, "c": null, "t": "direct", "e": [["tile_co", "sp", [8, 4, 4]], ["tile_oh", "sp", [27, 1, 1]], ["tile_ow", "sp", [9, 1, 3]], ["reorder_0", "re", [0, 1, 2, 3, 4, 5, 6, 9, 7, 8]], ["ann_reduce", "an", ["none", "unroll"]], ["ann_spatial", "an", ["none", "unroll", "vec"]]]}], "v": 0.1, "r": [[0.000720014875], 0, 0.44545745849609375, 1534787339.650611]}
{"i": ["opencl -model=rk3399 -device=mali", "topi_nn_conv2d", [["TENSOR", [1, 32, 27, 27], "float32"], ["TENSOR", [128, 32, 3, 3], "float32"], [1, 1], [1, 1], "NCHW", "float32"], {}, ["conv2d", [1, 32, 27, 27, "float32"], [128, 32, 3, 3, "float32"], [1, 1], [1, 1], "NCHW", "float32"], {"i": 387379, "c": null, "t": "direct", "e": [["tile_co", "sp", [2, 16, 4]], ["tile_oh", "sp", [27, 1, 1]], ["tile_ow", "sp", [1, 9, 3]], ["reorder_0", "re", [0, 1, 2, 3, 4, 5, 6, 9, 7, 8]], ["ann_reduce", "an", ["none", "unroll"]], ["ann_spatial", "an", ["unroll", "unroll", "vec"]]]}], "v": 0.1, "r": [[0.002533298875], 0, 0.6990301609039307, 1534787829.1735094]}
{"i": ["opencl -model=rk3399 -device=mali", "topi_nn_conv2d", [["TENSOR", [1, 256, 27, 27], "float32"], ["TENSOR", [32, 256, 1, 1], "float32"], [1, 1], [0, 0], "NCHW", "float32"], {}, ["conv2d", [1, 256, 27, 27, "float32"], [32, 256, 1, 1, "float32"], [1, 1], [0, 0], "NCHW", "float32"], {"i": 99553, "c": null, "t": "direct", "e": [["tile_co", "sp", [2, 4, 4]], ["tile_oh", "sp", [27, 1, 1]], ["tile_ow", "sp", [9, 1, 3]], ["reorder_0", "re", [0, 1, 2, 3, 4, 5, 6, 9, 7, 8]], ["ann_reduce", "an", ["unroll", "unroll"]], ["ann_spatial", "an", ["none", "unroll", "vec"]]]}], "v": 0.1, "r": [[0.00112849375], 0, 0.4669630527496338, 1534788519.350505]}
{"i": ["opencl -model=rk3399 -device=mali", "topi_nn_conv2d", [["TENSOR", [1, 256, 13, 13], "float32"], ["TENSOR", [48, 256, 1, 1], "float32"], [1, 1], [0, 0], "NCHW", "float32"], {}, ["conv2d", [1, 256, 13, 13, "float32"], [48, 256, 1, 1, "float32"], [1, 1], [0, 0], "NCHW", "float32"], {"i": 34909, "c": null, "t": "direct", "e": [["tile_co", "sp", [3, 2, 8]], ["tile_oh", "sp", [1, 13, 1]], ["tile_ow", "sp", [13, 1, 1]], ["reorder_0", "re", [0, 1, 2, 3, 4, 5, 6, 7, 8, 9]], ["ann_reduce", "an", ["unroll", "unroll"]], ["ann_spatial", "an", ["unroll", "none", "vec"]]]}], "v": 0.1, "r": [[0.000679179875], 0, 0.4952850341796875, 1534789066.4712656]}
{"i": ["opencl -model=rk3399 -device=mali", "topi_nn_conv2d", [["TENSOR", [1, 48, 13, 13], "float32"], ["TENSOR", [192, 48, 1, 1], "float32"], [1, 1], [0, 0], "NCHW", "float32"], {}, ["conv2d", [1, 48, 13, 13, "float32"], [192, 48, 1, 1, "float32"], [1, 1], [0, 0], "NCHW", "float32"], {"i": 81715, "c": null, "t": "direct", "e": [["tile_co", "sp", [1, 12, 16]], ["tile_oh", "sp", [13, 1, 1]], ["tile_ow", "sp", [13, 1, 1]], ["reorder_0", "re", [0, 1, 2, 3, 4, 5, 6, 7, 8, 9]], ["ann_reduce", "an", ["unroll", "none"]], ["ann_spatial", "an", ["unroll", "unroll", "vec"]]]}], "v": 0.1, "r": [[0.000471697625], 0, 0.5158183574676514, 1534789467.3603568]}
{"i": ["opencl -model=rk3399 -device=mali", "topi_nn_conv2d", [["TENSOR", [1, 48, 13, 13], "float32"], ["TENSOR", [192, 48, 3, 3], "float32"], [1, 1], [1, 1], "NCHW", "float32"], {}, ["conv2d", [1, 48, 13, 13, "float32"], [192, 48, 3, 3, "float32"], [1, 1], [1, 1], "NCHW", "float32"], {"i": 65809, "c": null, "t": "direct", "e": [["tile_co", "sp", [8, 6, 4]], ["tile_oh", "sp", [13, 1, 1]], ["tile_ow", "sp", [13, 1, 1]], ["reorder_0", "re", [0, 1, 2, 3, 4, 5, 6, 9, 7, 8]], ["ann_reduce", "an", ["unroll", "unroll"]], ["ann_spatial", "an", ["unroll", "none", "vec"]]]}], "v": 0.1, "r": [[0.0022707995], 0, 0.7499988079071045, 1534790026.0973186]}
{"i": ["opencl -model=rk3399 -device=mali", "topi_nn_conv2d", [["TENSOR", [1, 384, 13, 13], "float32"], ["TENSOR", [48, 384, 1, 1], "float32"], [1, 1], [0, 0], "NCHW", "float32"], {}, ["conv2d", [1, 384, 13, 13, "float32"], [48, 384, 1, 1, "float32"], [1, 1], [0, 0], "NCHW", "float32"], {"i": 45124, "c": null, "t": "direct", "e": [["tile_co", "sp", [3, 2, 8]], ["tile_oh", "sp", [13, 1, 1]], ["tile_ow", "sp", [1, 13, 1]], ["reorder_0", "re", [0, 1, 2, 3, 4, 5, 6, 9, 7, 8]], ["ann_reduce", "an", ["unroll", "unroll"]], ["ann_spatial", "an", ["unroll", "unroll", "vec"]]]}], "v": 0.1, "r": [[0.000964101125], 0, 0.45015430450439453, 1534790533.7602704]}
{"i": ["opencl -model=rk3399 -device=mali", "topi_nn_conv2d", [["TENSOR", [1, 384, 13, 13], "float32"], ["TENSOR", [64, 384, 1, 1], "float32"], [1, 1], [0, 0], "NCHW", "float32"], {}, ["conv2d", [1, 384, 13, 13, "float32"], [64, 384, 1, 1, "float32"], [1, 1], [0, 0], "NCHW", "float32"], {"i": 27993, "c": null, "t": "direct", "e": [["tile_co", "sp", [1, 8, 8]], ["tile_oh", "sp", [13, 1, 1]], ["tile_ow", "sp", [13, 1, 1]], ["reorder_0", "re", [0, 1, 2, 3, 4, 5, 6, 9, 7, 8]], ["ann_reduce", "an", ["unroll", "unroll"]], ["ann_spatial", "an", ["unroll", "unroll", "vec"]]]}], "v": 0.1, "r": [[0.000986561625], 0, 0.4286386966705322, 1534790875.5712688]}
{"i": ["opencl -model=rk3399 -device=mali", "topi_nn_conv2d", [["TENSOR", [1, 64, 13, 13], "float32"], ["TENSOR", [256, 64, 1, 1], "float32"], [1, 1], [0, 0], "NCHW", "float32"], {}, ["conv2d", [1, 64, 13, 13, "float32"], [256, 64, 1, 1, "float32"], [1, 1], [0, 0], "NCHW", "float32"], {"i": 33244, "c": null, "t": "direct", "e": [["tile_co", "sp", [1, 16, 16]], ["tile_oh", "sp", [13, 1, 1]], ["tile_ow", "sp", [13, 1, 1]], ["reorder_0", "re", [0, 1, 2, 3, 4, 5, 6, 7, 8, 9]], ["ann_reduce", "an", ["none", "unroll"]], ["ann_spatial", "an", ["unroll", "none", "vec"]]]}], "v": 0.1, "r": [[0.000641737375], 0, 0.44287848472595215, 1534791308.1715407]}
{"i": ["opencl -model=rk3399 -device=mali", "topi_nn_conv2d", [["TENSOR", [1, 64, 13, 13], "float32"], ["TENSOR", [256, 64, 3, 3], "float32"], [1, 1], [1, 1], "NCHW", "float32"], {}, ["conv2d", [1, 64, 13, 13, "float32"], [256, 64, 3, 3, "float32"], [1, 1], [1, 1], "NCHW", "float32"], {"i": 13112, "c": null, "t": "winograd", "e": [["tile_bna", "ot", 4], ["tile_bnb", "ot", 4], ["tile_t1", "sp", [1, 64]], ["tile_t2", "sp", [64, 4]], ["c_unroll", "sp", [32, 2]], ["yt", "ot", 4]]}], "v": 0.1, "r": [[0.001856853125], 0, 0.8097231388092041, 1534791707.3338065]}
{"i": ["opencl -model=rk3399 -device=mali", "topi_nn_conv2d", [["TENSOR", [1, 512, 13, 13], "float32"], ["TENSOR", [64, 512, 1, 1], "float32"], [1, 1], [0, 0], "NCHW", "float32"], {}, ["conv2d", [1, 512, 13, 13, "float32"], [64, 512, 1, 1, "float32"], [1, 1], [0, 0], "NCHW", "float32"], {"i": 27741, "c": null, "t": "direct", "e": [["tile_co", "sp", [1, 8, 8]], ["tile_oh", "sp", [13, 1, 1]], ["tile_ow", "sp", [13, 1, 1]], ["reorder_0", "re", [0, 1, 2, 3, 4, 5, 6, 7, 8, 9]], ["ann_reduce", "an", ["unroll", "unroll"]], ["ann_spatial", "an", ["unroll", "unroll", "vec"]]]}], "v": 0.1, "r": [[0.00126302175], 0, 0.4725668430328369, 1534792188.234129]}
{"i": ["opencl -model=rk3399 -device=mali", "topi_nn_conv2d", [["TENSOR", [1, 512, 13, 13], "float32"], ["TENSOR", [1000, 512, 1, 1], "float32"], [1, 1], [0, 0], "NCHW", "float32"], {}, ["conv2d", [1, 512, 13, 13, "float32"], [1000, 512, 1, 1, "float32"], [1, 1], [0, 0], "NCHW", "float32"], {"i": 39429, "c": null, "t": "direct", "e": [["tile_co", "sp", [125, 2, 4]], ["tile_oh", "sp", [1, 13, 1]], ["tile_ow", "sp", [1, 1, 13]], ["reorder_0", "re", [0, 1, 2, 3, 4, 5, 6, 9, 7, 8]], ["ann_reduce", "an", ["none", "unroll"]], ["ann_spatial", "an", ["none", "unroll", "vec"]]]}], "v": 0.1, "r": [[0.012538046625], 0, 0.7728147506713867, 1534792723.6829607]}
{"i": ["opencl -model=rk3399 -device=mali", "topi_nn_dense", [["TENSOR", [1, 4096], "float32"], ["TENSOR", [1000, 4096], "float32"], ["TENSOR", [1000], "float32"]], {}, ["dense", [1, 4096, "float32"], [1000, 4096, "float32"], [1000, "float32"]], {"i": 411, "c": null, "t": "direct", "e": [["tile_y", "sp", [1, 1, 1]], ["tile_x", "sp", [8, 125, 1]], ["c_unroll", "sp", [256, 16]]]}], "v": 0.1, "r": [[0.003311912875], 0, 0.4886302947998047, 1534818043.061828]}
{"i": ["opencl -model=rk3399 -device=mali", "topi_nn_dense", [["TENSOR", [1, 4096], "float32"], ["TENSOR", [4096, 4096], "float32"], ["TENSOR", [4096], "float32"]], {}, ["dense", [1, 4096, "float32"], [4096, 4096, "float32"], [4096, "float32"]], {"i": 367, "c": null, "t": "direct", "e": [["tile_y", "sp", [1, 1, 1]], ["tile_x", "sp", [512, 8, 1]], ["c_unroll", "sp", [256, 16]]]}], "v": 0.1, "r": [[0.012454858], 0, 0.6769485473632812, 1534818338.715345]}
{"i": ["opencl -model=rk3399 -device=mali", "topi_nn_dense", [["TENSOR", [1, 25088], "float32"], ["TENSOR", [4096, 25088], "float32"], ["TENSOR", [4096], "float32"]], {}, ["dense", [1, 25088, "float32"], [4096, 25088, "float32"], [4096, "float32"]], {"i": 735, "c": null, "t": "direct", "e": [["tile_y", "sp", [1, 1, 1]], ["tile_x", "sp", [32, 128, 1]], ["c_unroll", "sp", [784, 32]]]}], "v": 0.1, "r": [[0.075991881375], 0, 1.5630879402160645, 1534818980.27484]}
{"i": ["opencl -model=rk3399 -device=mali", "topi_nn_conv2d", [["TENSOR", [1, 512, 14, 14], "float32"], ["TENSOR", [512, 512, 3, 3], "float32"], [1, 1], [1, 1], "NCHW", "float32"], {}, ["conv2d", [1, 512, 14, 14, "float32"], [512, 512, 3, 3, "float32"], [1, 1], [1, 1], "NCHW", "float32"], {"i": 15762, "c": null, "t": "winograd", "e": [["tile_bna", "ot", 4], ["tile_bnb", "ot", 4], ["tile_t1", "sp", [8, 64]], ["tile_t2", "sp", [8, 64]], ["c_unroll", "sp", [256, 2]], ["yt", "ot", 4]]}], "v": 0.1, "r": [[0.0155993035], 0, 3.5993149280548096, 1534821654.488517]}
{"i": ["opencl -model=rk3399 -device=mali", "topi_nn_conv2d", [["TENSOR", [1, 512, 28, 28], "float32"], ["TENSOR", [512, 512, 3, 3], "float32"], [1, 1], [1, 1], "NCHW", "float32"], {}, ["conv2d", [1, 512, 28, 28, "float32"], [512, 512, 3, 3, "float32"], [1, 1], [1, 1], "NCHW", "float32"], {"i": 15587, "c": null, "t": "winograd", "e": [["tile_bna", "ot", 4], ["tile_bnb", "ot", 4], ["tile_t1", "sp", [4, 128]], ["tile_t2", "sp", [16, 32]], ["c_unroll", "sp", [256, 2]], ["yt", "ot", 4]]}], "v": 0.1, "r": [[0.048120392375], 0, 3.7011749744415283, 1534822487.4794745]}
{"i": ["opencl -model=rk3399 -device=mali", "topi_nn_conv2d", [["TENSOR", [1, 256, 28, 28], "float32"], ["TENSOR", [512, 256, 3, 3], "float32"], [1, 1], [1, 1], "NCHW", "float32"], {}, ["conv2d", [1, 256, 28, 28, "float32"], [512, 256, 3, 3, "float32"], [1, 1], [1, 1], "NCHW", "float32"], {"i": 15187, "c": null, "t": "winograd", "e": [["tile_bna", "ot", 4], ["tile_bnb", "ot", 4], ["tile_t1", "sp", [2, 128]], ["tile_t2", "sp", [64, 8]], ["c_unroll", "sp", [128, 2]], ["yt", "ot", 4]]}], "v": 0.1, "r": [[0.024304051625], 0, 3.4683997631073, 1534823513.6380692]}
{"i": ["opencl -model=rk3399 -device=mali", "topi_nn_conv2d", [["TENSOR", [1, 256, 56, 56], "float32"], ["TENSOR", [256, 256, 3, 3], "float32"], [1, 1], [1, 1], "NCHW", "float32"], {}, ["conv2d", [1, 256, 56, 56, "float32"], [256, 256, 3, 3, "float32"], [1, 1], [1, 1], "NCHW", "float32"], {"i": 22062, "c": null, "t": "winograd", "e": [["tile_bna", "ot", 4], ["tile_bnb", "ot", 4], ["tile_t1", "sp", [64, 4]], ["tile_t2", "sp", [4, 64]], ["c_unroll", "sp", [128, 2]], ["yt", "ot", 8]]}], "v": 0.1, "r": [[0.052477982], 0, 4.412038087844849, 1534824878.4866295]}
{"i": ["opencl -model=rk3399 -device=mali", "topi_nn_conv2d", [["TENSOR", [1, 128, 56, 56], "float32"], ["TENSOR", [256, 128, 3, 3], "float32"], [1, 1], [1, 1], "NCHW", "float32"], {}, ["conv2d", [1, 128, 56, 56, "float32"], [256, 128, 3, 3, "float32"], [1, 1], [1, 1], "NCHW", "float32"], {"i": 21362, "c": null, "t": "winograd", "e": [["tile_bna", "ot", 4], ["tile_bnb", "ot", 4], ["tile_t1", "sp", [2, 64]], ["tile_t2", "sp", [64, 4]], ["c_unroll", "sp", [64, 2]], ["yt", "ot", 8]]}], "v": 0.1, "r": [[0.0289347335], 0, 3.6275808811187744, 1534825956.014466]}
{"i": ["opencl -model=rk3399 -device=mali", "topi_nn_conv2d", [["TENSOR", [1, 128, 112, 112], "float32"], ["TENSOR", [128, 128, 3, 3], "float32"], [1, 1], [1, 1], "NCHW", "float32"], {}, ["conv2d", [1, 128, 112, 112, "float32"], [128, 128, 3, 3, "float32"], [1, 1], [1, 1], "NCHW", "float32"], {"i": 22387, "c": null, "t": "winograd", "e": [["tile_bna", "ot", 4], ["tile_bnb", "ot", 4], ["tile_t1", "sp", [1, 128]], ["tile_t2", "sp", [1, 128]], ["c_unroll", "sp", [64, 2]], ["yt", "ot", 8]]}], "v": 0.1, "r": [[0.074649106625], 0, 4.001387596130371, 1534827039.0181057]}
{"i": ["opencl -model=rk3399 -device=mali", "topi_nn_conv2d", [["TENSOR", [1, 64, 112, 112], "float32"], ["TENSOR", [128, 64, 3, 3], "float32"], [1, 1], [1, 1], "NCHW", "float32"], {}, ["conv2d", [1, 64, 112, 112, "float32"], [128, 64, 3, 3, "float32"], [1, 1], [1, 1], "NCHW", "float32"], {"i": 13087, "c": null, "t": "winograd", "e": [["tile_bna", "ot", 4], ["tile_bnb", "ot", 4], ["tile_t1", "sp", [2, 32]], ["tile_t2", "sp", [32, 4]], ["c_unroll", "sp", [32, 2]], ["yt", "ot", 4]]}], "v": 0.1, "r": [[0.042475338875], 0, 3.8806769847869873, 1534828420.263525]}
{"i": ["opencl -model=rk3399 -device=mali", "topi_nn_conv2d", [["TENSOR", [1, 64, 224, 224], "float32"], ["TENSOR", [64, 64, 3, 3], "float32"], [1, 1], [1, 1], "NCHW", "float32"], {}, ["conv2d", [1, 64, 224, 224, "float32"], [64, 64, 3, 3, "float32"], [1, 1], [1, 1], "NCHW", "float32"], {"i": 16787, "c": null, "t": "winograd", "e": [["tile_bna", "ot", 4], ["tile_bnb", "ot", 4], ["tile_t1", "sp", [1, 64]], ["tile_t2", "sp", [4, 16]], ["c_unroll", "sp", [32, 2]], ["yt", "ot", 8]]}], "v": 0.1, "r": [[0.120148021], 0, 4.411911964416504, 1534829506.7323253]}
{"i": ["opencl -model=rk3399 -device=mali", "topi_nn_conv2d", [["TENSOR", [1, 3, 224, 224], "float32"], ["TENSOR", [64, 3, 3, 3], "float32"], [1, 1], [1, 1], "NCHW", "float32"], {}, ["conv2d", [1, 3, 224, 224, "float32"], [64, 3, 3, 3, "float32"], [1, 1], [1, 1], "NCHW", "float32"], {"i": 12254859, "c": null, "t": "direct", "e": [["tile_co", "sp", [4, 4, 4]], ["tile_oh", "sp", [112, 1, 2]], ["tile_ow", "sp", [8, 14, 2]], ["reorder_0", "re", [0, 1, 2, 3, 4, 5, 6, 7, 8, 9]], ["ann_reduce", "an", ["unroll", "unroll"]], ["ann_spatial", "an", ["unroll", "unroll", "vec"]]]}], "v": 0.1, "r": [[0.011445748], 0, 1.167954921722412, 1534832469.265503]}
{"i": ["opencl -model=rk3399 -device=mali", "topi_nn_conv2d", [["TENSOR", [1, 3, 224, 224], "float32"], ["TENSOR", [32, 3, 3, 3], "float32"], [2, 2], [1, 1], "NCHW", "float32"], {}, ["conv2d", [1, 3, 224, 224, "float32"], [32, 3, 3, 3, "float32"], [2, 2], [1, 1], "NCHW", "float32"], {"i": 4528453, "c": null, "t": "direct", "e": [["tile_co", "sp", [2, 4, 4]], ["tile_oh", "sp", [112, 1, 1]], ["tile_ow", "sp", [2, 14, 4]], ["reorder_0", "re", [0, 1, 2, 3, 4, 5, 6, 7, 8, 9]], ["ann_reduce", "an", ["none", "unroll"]], ["ann_spatial", "an", ["unroll", "unroll", "vec"]]]}], "v": 0.1, "r": [[0.00200064425], 0, 0.7528524398803711, 1534773368.5821507]}
{"i": ["opencl -model=rk3399 -device=mali", "topi_nn_depthwise_conv2d_nchw", [["TENSOR", [1, 32, 112, 112], "float32"], ["TENSOR", [32, 1, 3, 3], "float32"], [1, 1], [1, 1], "float32"], {}, ["depthwise_conv2d_nchw", [1, 32, 112, 112, "float32"], [32, 1, 3, 3, "float32"], [1, 1], [1, 1], "float32"], {"i": 324169, "c": null, "t": "direct", "e": [["tile_c", "sp", [2, 4, 4]], ["tile_y", "sp", [56, 2, 1]], ["tile_x", "sp", [1, 16, 7]], ["ann_spatial", "an", ["none", "vec", "unroll"]]]}], "v": 0.1, "r": [[0.001813073], 0, 0.6081998348236084, 1534774028.4084568]}
{"i": ["opencl -model=rk3399 -device=mali", "topi_nn_conv2d", [["TENSOR", [1, 32, 112, 112], "float32"], ["TENSOR", [64, 32, 1, 1], "float32"], [1, 1], [0, 0], "NCHW", "float32"], {}, ["conv2d", [1, 32, 112, 112, "float32"], [64, 32, 1, 1, "float32"], [1, 1], [0, 0], "NCHW", "float32"], {"i": 2522535, "c": null, "t": "direct", "e": [["tile_co", "sp", [4, 4, 4]], ["tile_oh", "sp", [112, 1, 1]], ["tile_ow", "sp", [2, 14, 4]], ["reorder_0", "re", [0, 1, 2, 3, 4, 5, 6, 7, 8, 9]], ["ann_reduce", "an", ["unroll", "none"]], ["ann_spatial", "an", ["none", "unroll", "vec"]]]}], "v": 0.1, "r": [[0.004092848125], 0, 0.5883266925811768, 1534774593.4489887]}
{"i": ["opencl -model=rk3399 -device=mali", "topi_nn_depthwise_conv2d_nchw", [["TENSOR", [1, 64, 112, 112], "float32"], ["TENSOR", [64, 1, 3, 3], "float32"], [2, 2], [1, 1], "float32"], {}, ["depthwise_conv2d_nchw", [1, 64, 112, 112, "float32"], [64, 1, 3, 3, "float32"], [2, 2], [1, 1], "float32"], {"i": 189002, "c": null, "t": "direct", "e": [["tile_c", "sp", [16, 4, 1]], ["tile_y", "sp", [56, 1, 1]], ["tile_x", "sp", [7, 2, 4]], ["ann_spatial", "an", ["none", "vec", "unroll"]]]}], "v": 0.1, "r": [[0.002193945625], 0, 0.5276098251342773, 1534775430.4121592]}
{"i": ["opencl -model=rk3399 -device=mali", "topi_nn_conv2d", [["TENSOR", [1, 64, 56, 56], "float32"], ["TENSOR", [128, 64, 1, 1], "float32"], [1, 1], [0, 0], "NCHW", "float32"], {}, ["conv2d", [1, 64, 56, 56, "float32"], [128, 64, 1, 1, "float32"], [1, 1], [0, 0], "NCHW", "float32"], {"i": 1379177, "c": null, "t": "direct", "e": [["tile_co", "sp", [8, 4, 4]], ["tile_oh", "sp", [56, 1, 1]], ["tile_ow", "sp", [1, 14, 4]], ["reorder_0", "re", [0, 1, 2, 3, 4, 5, 6, 7, 8, 9]], ["ann_reduce", "an", ["none", "unroll"]], ["ann_spatial", "an", ["none", "unroll", "vec"]]]}], "v": 0.1, "r": [[0.00319739475], 0, 0.485809326171875, 1534776123.653941]}
{"i": ["opencl -model=rk3399 -device=mali", "topi_nn_depthwise_conv2d_nchw", [["TENSOR", [1, 128, 56, 56], "float32"], ["TENSOR", [128, 1, 3, 3], "float32"], [1, 1], [1, 1], "float32"], {}, ["depthwise_conv2d_nchw", [1, 128, 56, 56, "float32"], [128, 1, 3, 3, "float32"], [1, 1], [1, 1], "float32"], {"i": 632882, "c": null, "t": "direct", "e": [["tile_c", "sp", [32, 4, 1]], ["tile_y", "sp", [56, 1, 1]], ["tile_x", "sp", [2, 7, 4]], ["ann_spatial", "an", ["vec", "unroll", "unroll"]]]}], "v": 0.1, "r": [[0.001546853625], 0, 0.501680850982666, 1534776729.2502508]}
{"i": ["opencl -model=rk3399 -device=mali", "topi_nn_conv2d", [["TENSOR", [1, 128, 56, 56], "float32"], ["TENSOR", [128, 128, 1, 1], "float32"], [1, 1], [0, 0], "NCHW", "float32"], {}, ["conv2d", [1, 128, 56, 56, "float32"], [128, 128, 1, 1, "float32"], [1, 1], [0, 0], "NCHW", "float32"], {"i": 1508778, "c": null, "t": "direct", "e": [["tile_co", "sp", [4, 8, 4]], ["tile_oh", "sp", [56, 1, 1]], ["tile_ow", "sp", [1, 14, 4]], ["reorder_0", "re", [0, 1, 2, 3, 4, 5, 6, 7, 8, 9]], ["ann_reduce", "an", ["unroll", "unroll"]], ["ann_spatial", "an", ["none", "unroll", "vec"]]]}], "v": 0.1, "r": [[0.00551769375], 0, 0.48728442192077637, 1534777149.812052]}
{"i": ["opencl -model=rk3399 -device=mali", "topi_nn_depthwise_conv2d_nchw", [["TENSOR", [1, 128, 56, 56], "float32"], ["TENSOR", [128, 1, 3, 3], "float32"], [2, 2], [1, 1], "float32"], {}, ["depthwise_conv2d_nchw", [1, 128, 56, 56, "float32"], [128, 1, 3, 3, "float32"], [2, 2], [1, 1], "float32"], {"i": 226154, "c": null, "t": "direct", "e": [["tile_c", "sp", [32, 4, 1]], ["tile_y", "sp", [28, 1, 1]], ["tile_x", "sp", [7, 2, 2]], ["ann_spatial", "an", ["vec", "unroll", "unroll"]]]}], "v": 0.1, "r": [[0.001192877875], 0, 0.5011789798736572, 1534777665.8544462]}
{"i": ["opencl -model=rk3399 -device=mali", "topi_nn_conv2d", [["TENSOR", [1, 128, 28, 28], "float32"], ["TENSOR", [256, 128, 1, 1], "float32"], [1, 1], [0, 0], "NCHW", "float32"], {}, ["conv2d", [1, 128, 28, 28, "float32"], [256, 128, 1, 1, "float32"], [1, 1], [0, 0], "NCHW", "float32"], {"i": 1611919, "c": null, "t": "direct", "e": [["tile_co", "sp", [16, 4, 4]], ["tile_oh", "sp", [28, 1, 1]], ["tile_ow", "sp", [7, 1, 4]], ["reorder_0", "re", [0, 1, 2, 3, 4, 5, 6, 7, 8, 9]], ["ann_reduce", "an", ["unroll", "unroll"]], ["ann_spatial", "an", ["unroll", "unroll", "vec"]]]}], "v": 0.1, "r": [[0.002707130625], 0, 0.6144781112670898, 1534778183.082869]}
{"i": ["opencl -model=rk3399 -device=mali", "topi_nn_depthwise_conv2d_nchw", [["TENSOR", [1, 256, 28, 28], "float32"], ["TENSOR", [256, 1, 3, 3], "float32"], [1, 1], [1, 1], "float32"], {}, ["depthwise_conv2d_nchw", [1, 256, 28, 28, "float32"], [256, 1, 3, 3, "float32"], [1, 1], [1, 1], "float32"], {"i": 112616, "c": null, "t": "direct", "e": [["tile_c", "sp", [8, 4, 8]], ["tile_y", "sp", [28, 1, 1]], ["tile_x", "sp", [2, 2, 7]], ["ann_spatial", "an", ["none", "vec", "unroll"]]]}], "v": 0.1, "r": [[0.001000376625], 0, 0.7370545864105225, 1534778832.3615906]}
{"i": ["opencl -model=rk3399 -device=mali", "topi_nn_conv2d", [["TENSOR", [1, 256, 28, 28], "float32"], ["TENSOR", [256, 256, 1, 1], "float32"], [1, 1], [0, 0], "NCHW", "float32"], {}, ["conv2d", [1, 256, 28, 28, "float32"], [256, 256, 1, 1, "float32"], [1, 1], [0, 0], "NCHW", "float32"], {"i": 650452, "c": null, "t": "direct", "e": [["tile_co", "sp", [2, 32, 4]], ["tile_oh", "sp", [28, 1, 1]], ["tile_ow", "sp", [1, 7, 4]], ["reorder_0", "re", [0, 1, 2, 3, 4, 5, 6, 7, 8, 9]], ["ann_reduce", "an", ["unroll", "none"]], ["ann_spatial", "an", ["none", "unroll", "vec"]]]}], "v": 0.1, "r": [[0.004925248375], 0, 0.5273537635803223, 1534779379.078077]}
{"i": ["opencl -model=rk3399 -device=mali", "topi_nn_depthwise_conv2d_nchw", [["TENSOR", [1, 256, 28, 28], "float32"], ["TENSOR", [256, 1, 3, 3], "float32"], [2, 2], [1, 1], "float32"], {}, ["depthwise_conv2d_nchw", [1, 256, 28, 28, "float32"], [256, 1, 3, 3, "float32"], [2, 2], [1, 1], "float32"], {"i": 56342, "c": null, "t": "direct", "e": [["tile_c", "sp", [64, 4, 1]], ["tile_y", "sp", [7, 2, 1]], ["tile_x", "sp", [7, 1, 2]], ["ann_spatial", "an", ["unroll", "vec", "unroll"]]]}], "v": 0.1, "r": [[0.0006491035], 0, 0.49543166160583496, 1534780068.517396]}
{"i": ["opencl -model=rk3399 -device=mali", "topi_nn_conv2d", [["TENSOR", [1, 256, 14, 14], "float32"], ["TENSOR", [512, 256, 1, 1], "float32"], [1, 1], [0, 0], "NCHW", "float32"], {}, ["conv2d", [1, 256, 14, 14, "float32"], [512, 256, 1, 1, "float32"], [1, 1], [0, 0], "NCHW", "float32"], {"i": 466036, "c": null, "t": "direct", "e": [["tile_co", "sp", [32, 4, 4]], ["tile_oh", "sp", [7, 1, 2]], ["tile_ow", "sp", [1, 7, 2]], ["reorder_0", "re", [0, 1, 2, 3, 4, 5, 6, 7, 8, 9]], ["ann_reduce", "an", ["none", "none"]], ["ann_spatial", "an", ["unroll", "unroll", "vec"]]]}], "v": 0.1, "r": [[0.00246884025], 0, 0.5229151248931885, 1534780537.357133]}
{"i": ["opencl -model=rk3399 -device=mali", "topi_nn_depthwise_conv2d_nchw", [["TENSOR", [1, 512, 14, 14], "float32"], ["TENSOR", [512, 1, 3, 3], "float32"], [1, 1], [1, 1], "float32"], {}, ["depthwise_conv2d_nchw", [1, 512, 14, 14, "float32"], [512, 1, 3, 3, "float32"], [1, 1], [1, 1], "float32"], {"i": 19857, "c": null, "t": "direct", "e": [["tile_c", "sp", [128, 4, 1]], ["tile_y", "sp", [7, 2, 1]], ["tile_x", "sp", [7, 1, 2]], ["ann_spatial", "an", ["none", "unroll", "unroll"]]]}], "v": 0.1, "r": [[0.000559161125], 0, 0.5547399520874023, 1534781044.603924]}
{"i": ["opencl -model=rk3399 -device=mali", "topi_nn_conv2d", [["TENSOR", [1, 512, 14, 14], "float32"], ["TENSOR", [512, 512, 1, 1], "float32"], [1, 1], [0, 0], "NCHW", "float32"], {}, ["conv2d", [1, 512, 14, 14, "float32"], [512, 512, 1, 1, "float32"], [1, 1], [0, 0], "NCHW", "float32"], {"i": 483361, "c": null, "t": "direct", "e": [["tile_co", "sp", [32, 4, 4]], ["tile_oh", "sp", [7, 1, 2]], ["tile_ow", "sp", [7, 1, 2]], ["reorder_0", "re", [0, 1, 2, 3, 4, 5, 6, 7, 8, 9]], ["ann_reduce", "an", ["unroll", "none"]], ["ann_spatial", "an", ["unroll", "unroll", "vec"]]]}], "v": 0.1, "r": [[0.004724582375], 0, 0.4876515865325928, 1534781539.8480072]}
{"i": ["opencl -model=rk3399 -device=mali", "topi_nn_depthwise_conv2d_nchw", [["TENSOR", [1, 512, 14, 14], "float32"], ["TENSOR", [512, 1, 3, 3], "float32"], [2, 2], [1, 1], "float32"], {}, ["depthwise_conv2d_nchw", [1, 512, 14, 14, "float32"], [512, 1, 3, 3, "float32"], [2, 2], [1, 1], "float32"], {"i": 8527, "c": null, "t": "direct", "e": [["tile_c", "sp", [128, 4, 1]], ["tile_y", "sp", [1, 1, 7]], ["tile_x", "sp", [7, 1, 1]], ["ann_spatial", "an", ["vec", "none", "unroll"]]]}], "v": 0.1, "r": [[0.0003942965], 0, 0.432330846786499, 1534782059.079115]}
{"i": ["opencl -model=rk3399 -device=mali", "topi_nn_conv2d", [["TENSOR", [1, 512, 7, 7], "float32"], ["TENSOR", [1024, 512, 1, 1], "float32"], [1, 1], [0, 0], "NCHW", "float32"], {}, ["conv2d", [1, 512, 7, 7, "float32"], [1024, 512, 1, 1, "float32"], [1, 1], [0, 0], "NCHW", "float32"], {"i": 50000, "c": null, "t": "direct", "e": [["tile_co", "sp", [64, 1, 16]], ["tile_oh", "sp", [1, 7, 1]], ["tile_ow", "sp", [7, 1, 1]], ["reorder_0", "re", [0, 1, 2, 3, 4, 5, 6, 7, 8, 9]], ["ann_reduce", "an", ["unroll", "none"]], ["ann_spatial", "an", ["unroll", "none", "vec"]]]}], "v": 0.1, "r": [[0.0039704815], 0, 0.5288665294647217, 1534782404.1005683]}
{"i": ["opencl -model=rk3399 -device=mali", "topi_nn_depthwise_conv2d_nchw", [["TENSOR", [1, 1024, 7, 7], "float32"], ["TENSOR", [1024, 1, 3, 3], "float32"], [1, 1], [1, 1], "float32"], {}, ["depthwise_conv2d_nchw", [1, 1024, 7, 7, "float32"], [1024, 1, 3, 3, "float32"], [1, 1], [1, 1], "float32"], {"i": 7564, "c": null, "t": "direct", "e": [["tile_c", "sp", [16, 4, 16]], ["tile_y", "sp", [7, 1, 1]], ["tile_x", "sp", [1, 1, 7]], ["ann_spatial", "an", ["unroll", "unroll", "unroll"]]]}], "v": 0.1, "r": [[0.000412161125], 0, 0.7525043487548828, 1534782760.153166]}
{"i": ["opencl -model=rk3399 -device=mali", "topi_nn_conv2d", [["TENSOR", [1, 1024, 7, 7], "float32"], ["TENSOR", [1024, 1024, 1, 1], "float32"], [1, 1], [0, 0], "NCHW", "float32"], {}, ["conv2d", [1, 1024, 7, 7, "float32"], [1024, 1024, 1, 1, "float32"], [1, 1], [0, 0], "NCHW", "float32"], {"i": 25433, "c": null, "t": "direct", "e": [["tile_co", "sp", [64, 4, 4]], ["tile_oh", "sp", [1, 7, 1]], ["tile_ow", "sp", [1, 1, 7]], ["reorder_0", "re", [0, 1, 2, 3, 4, 5, 6, 7, 8, 9]], ["ann_reduce", "an", ["none", "unroll"]], ["ann_spatial", "an", ["none", "unroll", "vec"]]]}], "v": 0.1, "r": [[0.0073324535], 0, 0.548271894454956, 1534783401.4130507]}
{"i": ["opencl -model=rk3399 -device=mali", "topi_nn_dense", [["TENSOR", [1, 1024], "float32"], ["TENSOR", [1000, 1024], "float32"], null], {}, ["dense", [1, 1024, "float32"], [1000, 1024, "float32"], 0], {"i": 405, "c": null, "t": "direct", "e": [["tile_y", "sp", [1, 1, 1]], ["tile_x", "sp", [100, 10, 1]], ["c_unroll", "sp", [64, 16]]]}], "v": 0.1, "r": [[0.000837445], 0, 0.42955708503723145, 1534783721.199702]}
{"i": ["opencl -model=rk3399 -device=mali", "topi_nn_conv2d", [["TENSOR", [1, 3, 224, 224], "float32"], ["TENSOR", [64, 3, 7, 7], "float32"], [2, 2], [3, 3], "NCHW", "float32"], {}, ["conv2d", [1, 3, 224, 224, "float32"], [64, 3, 7, 7, "float32"], [2, 2], [3, 3], "NCHW", "float32"], {"i": 6260956, "c": null, "t": "direct", "e": [["tile_co", "sp", [2, 8, 4]], ["tile_oh", "sp", [112, 1, 1]], ["tile_ow", "sp", [14, 2, 4]], ["reorder_0", "re", [0, 1, 2, 3, 4, 5, 6, 7, 8, 9]], ["ann_reduce", "an", ["unroll", "unroll"]], ["ann_spatial", "an", ["unroll", "unroll", "vec"]]]}], "v": 0.1, "r": [[0.010284194875], 0, 2.94393253326416, 1534761249.1270843]}
{"i": ["opencl -model=rk3399 -device=mali", "topi_nn_conv2d", [["TENSOR", [1, 64, 56, 56], "float32"], ["TENSOR", [64, 64, 3, 3], "float32"], [1, 1], [1, 1], "NCHW", "float32"], {}, ["conv2d", [1, 64, 56, 56, "float32"], [64, 64, 3, 3, "float32"], [1, 1], [1, 1], "NCHW", "float32"], {"i": 11537, "c": null, "t": "winograd", "e": [["tile_bna", "ot", 4], ["tile_bnb", "ot", 4], ["tile_t1", "sp", [1, 64]], ["tile_t2", "sp", [16, 4]], ["c_unroll", "sp", [32, 2]], ["yt", "ot", 4]]}], "v": 0.1, "r": [[0.007586188], 0, 3.5477077960968018, 1534762499.9938617]}
{"i": ["opencl -model=rk3399 -device=mali", "topi_nn_conv2d", [["TENSOR", [1, 64, 56, 56], "float32"], ["TENSOR", [64, 64, 1, 1], "float32"], [1, 1], [0, 0], "NCHW", "float32"], {}, ["conv2d", [1, 64, 56, 56, "float32"], [64, 64, 1, 1, "float32"], [1, 1], [0, 0], "NCHW", "float32"], {"i": 1123096, "c": null, "t": "direct", "e": [["tile_co", "sp", [2, 8, 4]], ["tile_oh", "sp", [56, 1, 1]], ["tile_ow", "sp", [1, 14, 4]], ["reorder_0", "re", [0, 1, 2, 3, 4, 5, 6, 7, 8, 9]], ["ann_reduce", "an", ["unroll", "none"]], ["ann_spatial", "an", ["none", "unroll", "vec"]]]}], "v": 0.1, "r": [[0.001882957125], 0, 0.4890718460083008, 1534763672.994914]}
{"i": ["opencl -model=rk3399 -device=mali", "topi_nn_conv2d", [["TENSOR", [1, 64, 56, 56], "float32"], ["TENSOR", [128, 64, 3, 3], "float32"], [2, 2], [1, 1], "NCHW", "float32"], {}, ["conv2d", [1, 64, 56, 56, "float32"], [128, 64, 3, 3, "float32"], [2, 2], [1, 1], "NCHW", "float32"], {"i": 497036, "c": null, "t": "direct", "e": [["tile_co", "sp", [1, 32, 4]], ["tile_oh", "sp", [28, 1, 1]], ["tile_ow", "sp", [1, 7, 4]], ["reorder_0", "re", [0, 1, 2, 3, 4, 5, 6, 7, 8, 9]], ["ann_reduce", "an", ["none", "unroll"]], ["ann_spatial", "an", ["none", "unroll", "vec"]]]}], "v": 0.1, "r": [[0.005680568875], 0, 0.7700390815734863, 1534764401.1836352]}
{"i": ["opencl -model=rk3399 -device=mali", "topi_nn_conv2d", [["TENSOR", [1, 64, 56, 56], "float32"], ["TENSOR", [128, 64, 1, 1], "float32"], [2, 2], [0, 0], "NCHW", "float32"], {}, ["conv2d", [1, 64, 56, 56, "float32"], [128, 64, 1, 1, "float32"], [2, 2], [0, 0], "NCHW", "float32"], {"i": 472416, "c": null, "t": "direct", "e": [["tile_co", "sp", [2, 8, 8]], ["tile_oh", "sp", [28, 1, 1]], ["tile_ow", "sp", [1, 14, 2]], ["reorder_0", "re", [0, 1, 2, 3, 4, 5, 6, 7, 8, 9]], ["ann_reduce", "an", ["none", "none"]], ["ann_spatial", "an", ["none", "unroll", "vec"]]]}], "v": 0.1, "r": [[0.001177967625], 0, 0.4484281539916992, 1534764989.805479]}
{"i": ["opencl -model=rk3399 -device=mali", "topi_nn_conv2d", [["TENSOR", [1, 128, 28, 28], "float32"], ["TENSOR", [128, 128, 3, 3], "float32"], [1, 1], [1, 1], "NCHW", "float32"], {}, ["conv2d", [1, 128, 28, 28, "float32"], [128, 128, 3, 3, "float32"], [1, 1], [1, 1], "NCHW", "float32"], {"i": 14962, "c": null, "t": "winograd", "e": [["tile_bna", "ot", 4], ["tile_bnb", "ot", 4], ["tile_t1", "sp", [2, 64]], ["tile_t2", "sp", [32, 4]], ["c_unroll", "sp", [64, 2]], ["yt", "ot", 4]]}], "v": 0.1, "r": [[0.005625626375], 0, 3.2549877166748047, 1534767313.6676424]}
{"i": ["opencl -model=rk3399 -device=mali", "topi_nn_conv2d", [["TENSOR", [1, 128, 28, 28], "float32"], ["TENSOR", [256, 128, 3, 3], "float32"], [2, 2], [1, 1], "NCHW", "float32"], {}, ["conv2d", [1, 128, 28, 28, "float32"], [256, 128, 3, 3, "float32"], [2, 2], [1, 1], "NCHW", "float32"], {"i": 388190, "c": null, "t": "direct", "e": [["tile_co", "sp", [8, 8, 4]], ["tile_oh", "sp", [7, 1, 2]], ["tile_ow", "sp", [7, 1, 2]], ["reorder_0", "re", [0, 1, 2, 3, 4, 5, 6, 7, 8, 9]], ["ann_reduce", "an", ["none", "unroll"]], ["ann_spatial", "an", ["unroll", "unroll", "vec"]]]}], "v": 0.1, "r": [[0.005902439625], 0, 0.8474347591400146, 1534768375.856058]}
{"i": ["opencl -model=rk3399 -device=mali", "topi_nn_conv2d", [["TENSOR", [1, 128, 28, 28], "float32"], ["TENSOR", [256, 128, 1, 1], "float32"], [2, 2], [0, 0], "NCHW", "float32"], {}, ["conv2d", [1, 128, 28, 28, "float32"], [256, 128, 1, 1, "float32"], [2, 2], [0, 0], "NCHW", "float32"], {"i": 155139, "c": null, "t": "direct", "e": [["tile_co", "sp", [32, 1, 8]], ["tile_oh", "sp", [14, 1, 1]], ["tile_ow", "sp", [1, 7, 2]], ["reorder_0", "re", [0, 1, 2, 3, 4, 5, 6, 7, 8, 9]], ["ann_reduce", "an", ["none", "unroll"]], ["ann_spatial", "an", ["none", "unroll", "vec"]]]}], "v": 0.1, "r": [[0.001074315625], 0, 0.5022807121276855, 1534769116.9767928]}
{"i": ["opencl -model=rk3399 -device=mali", "topi_nn_conv2d", [["TENSOR", [1, 256, 14, 14], "float32"], ["TENSOR", [256, 256, 3, 3], "float32"], [1, 1], [1, 1], "NCHW", "float32"], {}, ["conv2d", [1, 256, 14, 14, "float32"], [256, 256, 3, 3, "float32"], [1, 1], [1, 1], "NCHW", "float32"], {"i": 15937, "c": null, "t": "winograd", "e": [["tile_bna", "ot", 4], ["tile_bnb", "ot", 4], ["tile_t1", "sp", [8, 32]], ["tile_t2", "sp", [2, 128]], ["c_unroll", "sp", [128, 2]], ["yt", "ot", 4]]}], "v": 0.1, "r": [[0.004964003125], 0, 3.135413408279419, 1534770163.7046216]}
{"i": ["opencl -model=rk3399 -device=mali", "topi_nn_conv2d", [["TENSOR", [1, 256, 14, 14], "float32"], ["TENSOR", [512, 256, 3, 3], "float32"], [2, 2], [1, 1], "NCHW", "float32"], {}, ["conv2d", [1, 256, 14, 14, "float32"], [512, 256, 3, 3, "float32"], [2, 2], [1, 1], "NCHW", "float32"], {"i": 54854, "c": null, "t": "direct", "e": [["tile_co", "sp", [128, 1, 4]], ["tile_oh", "sp", [1, 7, 1]], ["tile_ow", "sp", [1, 1, 7]], ["reorder_0", "re", [0, 1, 2, 3, 4, 5, 6, 7, 8, 9]], ["ann_reduce", "an", ["unroll", "unroll"]], ["ann_spatial", "an", ["unroll", "unroll", "vec"]]]}], "v": 0.1, "r": [[0.007773692], 0, 0.8076512813568115, 1534771113.8428004]}
{"i": ["opencl -model=rk3399 -device=mali", "topi_nn_conv2d", [["TENSOR", [1, 256, 14, 14], "float32"], ["TENSOR", [512, 256, 1, 1], "float32"], [2, 2], [0, 0], "NCHW", "float32"], {}, ["conv2d", [1, 256, 14, 14, "float32"], [512, 256, 1, 1, "float32"], [2, 2], [0, 0], "NCHW", "float32"], {"i": 42660, "c": null, "t": "direct", "e": [["tile_co", "sp", [16, 2, 16]], ["tile_oh", "sp", [1, 7, 1]], ["tile_ow", "sp", [7, 1, 1]], ["reorder_0", "re", [0, 1, 2, 3, 4, 5, 6, 7, 8, 9]], ["ann_reduce", "an", ["unroll", "unroll"]], ["ann_spatial", "an", ["unroll", "none", "vec"]]]}], "v": 0.1, "r": [[0.001231853], 0, 0.5199625492095947, 1534771592.6220534]}
{"i": ["opencl -model=rk3399 -device=mali", "topi_nn_conv2d", [["TENSOR", [1, 512, 7, 7], "float32"], ["TENSOR", [512, 512, 3, 3], "float32"], [1, 1], [1, 1], "NCHW", "float32"], {}, ["conv2d", [1, 512, 7, 7, "float32"], [512, 512, 3, 3, "float32"], [1, 1], [1, 1], "NCHW", "float32"], {"i": 15512, "c": null, "t": "winograd", "e": [["tile_bna", "ot", 4], ["tile_bnb", "ot", 4], ["tile_t1", "sp", [32, 16]], ["tile_t2", "sp", [16, 32]], ["c_unroll", "sp", [256, 2]], ["yt", "ot", 4]]}], "v": 0.1, "r": [[0.00600659925], 0, 1.1295292377471924, 1534771891.6389847]}
{"i": ["opencl -model=rk3399 -device=mali", "topi_nn_dense", [["TENSOR", [1, 512], "float32"], ["TENSOR", [1000, 512], "float32"], ["TENSOR", [1000], "float32"]], {}, ["dense", [1, 512, "float32"], [1000, 512, "float32"], [1000, "float32"]], {"i": 305, "c": null, "t": "direct", "e": [["tile_y", "sp", [1, 1, 1]], ["tile_x", "sp", [100, 10, 1]], ["c_unroll", "sp", [64, 8]]]}], "v": 0.1, "r": [[0.00048095775], 0, 0.48343324661254883, 1534772263.704716]}
